,title,body
16,Wheezing,"What Is Wheezing? Wheezing is a high-pitched, coarse whistling sound when you breathe . Many people with respiratory allergies know that wheezing often comes with hay fever season. It may also happen because of respiratory infections like acute bronchitis. But chronic obstructive pulmonary disease ( COPD ) and asthma are the most common causes. A number of treatments can ease wheezing. Your doctor should keep close watch if you have asthma, severe allergies, long-term bronchitis , emphysema , or COPD . You also may need to see a specialist such as an allergist or pulmonologist . Wheezing can come with a variety of health conditions. But see your doctor if you have trouble breathing, your breathing gets fast, or your skin turns blue for a short time. Go to the ER if you start wheezing during a severe allergic reaction. What Causes Wheezing? The whistling sound happens when air moves through narrowed airways, much like the way a whistle or flute makes music. Many health problems can cause wheezing , including: Asthma . This condition, in which your airways narrow, swell, and make extra mucus , can make it hard to breathe. Allergic reactions to pollen , chemicals, pet dander, dust, foods, or insect stings Bronchitis COPD Cystic fibrosis , which damages your lungs and makes the mucus extra sticky and thick Obstruction of an airway because you’ve inhaled an object such as a coin Lung cancer Congestive heart failure Pneumonia . This infection inflames the air sacs in your lungs, and they fill with fluid or pus. Bronchiolitis. This lung infection inflames airways and causes congestion , usually in children. Emphysema, a lung condition that causes shortness of breath Smoking or breathing in smoke Respiratory syncytial virus . This can lead to bronchiolitis. Gastroesophageal reflux disease ( GERD ) Vocal cord problems Sleep apnea Wheezing Risk Factors Anyone can have wheezing. It often happens in infants, possibly because of their smaller airways. It’s also common in children who have asthma or bronchiolitis. Adults who smoke or who have emphysema or heart failure are more likely to have wheezing. When to See a Doctor Mild wheezing, the type that happens when you have a cold , should go away when the illness does. But you should see a doctor if you have: Trouble breathing Fast breathing Skin that briefly turns blue Go to the ER if your wheezing: Starts soon after you’re stung by a bee or just after you take medication or eat food that can cause an allergy Comes with severe breathing trouble or bluish skin Happens after you choke on a bit of food Diagnosing the Cause of Wheezing Your doctor will ask you questions like: How long have you been wheezing? Does it happen when you exercise ? Do you wheeze all the time? Do you wheeze more during the day, or at night? Does rest help control it? Do you wheeze when you breathe in, or out, or both in and out? Do you smoke? Do certain foods seem to cause your wheezing? They’ll listen to your breathing and the sounds your lungs make. They might do tests like: X-rays to get a picture of your lungs Lung function tests to see how well they’re working A blood test to check your oxygen levels (Those that are too low could signal a lung problem.) If your child is wheezing, their doctor might check to see if they’ve swallowed or inhaled something small. How Is Wheezing Treated? The first thing your doctor may do is give you oxygen. You might need to stay in the hospital until you get better. After that, treatment depends on the cause. Some common causes and treatments include: Asthma. Your doctor will probably prescribe: A bronchodilator medication to ease inflammation and open your airways Inhaled corticosteroids to fight inflammation Leukotriene receptor antagonists to prevent asthma and allergy symptoms Bronchitis. Your doctor will prescribe: A bronchodilator to open your airways An antibiotic to fight a bacterial infection How to Stop Wheezing There are a few things you can do to prevent wheezing: Keep the air moist. Use a humidifier , take a warm, steamy shower, or sit in the bathroom with the door closed while running a hot shower. Drink something warm. It relaxes your airways and loosens sticky mucus . Don’t smoke. And stay away from people who do. Follow your doctor’s orders. Take your medicines according to the instructions. Clean the air. Use an air cleaner with a HEPA filter . This will cut down on allergens that often lead to asthma attacks . Breathing Exercises for Wheezing Breathing exercises can help your lungs work better. Try these: Pursed-lip breathing . Breathe in through your nose. Breathe out for twice as long, with your lips pursed like you’re going to whistle. Belly breathing . Breathe in through your nose. Put your hands on your belly and pay attention to how it expands. Breathe out through your mouth for at least two to three times as long as you breathed in."
17,Whiplash,"Whiplash , also called neck sprain or neck strain, is injury to the neck. Whiplash is characterized by a collection of symptoms that occur following damage to the neck. In whiplash, the intervertebral joints (located between vertebrae), discs, and ligaments, cervical muscles, and nerve roots may become damaged. What Causes Whiplash? Whiplash is caused by an abrupt backward and/or forward jerking motion of the head, often as a result of a car accident. What Are the Symptoms of Whiplash? Symptoms of whiplash may be delayed for 24 hours or more after the initial trauma. However, people who experience whiplash may develop one or more of the following symptoms, usually within the first few days after the injury: Neck pain and stiffness Headaches Pain in the shoulder or between the shoulder blades Low back pain Pain or numbness in the arm and/or hand Dizziness Difficulty concentrating or remembering Irritability, sleep disturbances, fatigue How Is Whiplash Diagnosed? In most cases, injuries are to soft tissues such as the discs, muscles and ligaments, and cannot be seen on standard X-rays. Specialized imaging tests, such as CT scans or magnetic resonance imaging ( MRI ), may be required to diagnose damage to the discs, muscles or ligaments that could be causing the symptoms of whiplash. How Is Whiplash Treated? No single treatment has been scientifically proven as effective for whiplash, but pain relief medications such as ibuprofen ( Motrin , Advil ) or naproxen ( Aleve , Naprosyn ), along with gentle exercises, physical therapy , traction, massage , heat, ice, injections and ultrasound , all have been helpful for certain patients. In the past, whiplash injuries were often treated with immobilization in a cervical collar. However, the current trend is to encourage early movement instead of immobilization. Ice is often recommended for the first 24 hours, followed by gentle, active movement."
18,What Is Whipple’s Disease?,"Whipple’s disease was first recognized in 1907 by George Hoyt Whipple. The case centered on a man who had problems with weight loss , arthritis , chronic cough , and fever . More than a century later, doctors still don’t know much about the disease, but they do have ways to treat it. Whipple’s disease is a bacterial infection . The bacteria usually affect your digestive system , especially your small intestine, but they can cause problems in other parts of your body, too, like your heart , joints, lungs , eyes , and immune system . And up to 40% of people with Whipple’s disease also have issues related to their nervous system, which includes your brain , spinal cord, and the network of nerves that run throughout your body. If it’s not treated, Whipple’s disease can be life-threatening in a short amount of time. Doctors only know of a few hundred cases of the condition, most in North America and western Europe. White men and people older than 40 are most likely to get it. Symptoms Whipple’s disease can affect how you digest food and take in nutrients. It can make you weak and tired and lead to: Belly pain Diarrhea Weight loss Dark spots on your skin Joint pain If it affects your nervous system, it can bring on: Loss of muscle control Confusion and memory loss Seizures Vision problems In some people, Whipple's disease can cause coughing , fever, and chest pain . Causes Bacteria called T. whipplei cause Whipple’s disease. Scientists aren’t exactly sure how the bacteria get in your body, but they think it may be a part of some people’s normal mix of bacteria or it may come in through your mouth . There’s no evidence that it can be passed from person to person. Researchers have found that many people with the disease work with or near soil, like on farms or in construction, or have a problem with their immune system. It also may be linked to a problem gene. Diagnosis If your doctor thinks you might have Whipple’s disease, they’ll talk with you about your medical history and do a physical exam to check for pain or tenderness in your belly or dark spots on your skin. They’ll also test a sample of your blood to see if you’re low on any nutrients. They’ll probably recommend a procedure called an upper GI endoscopy -- a flexible tube with a camera on the end lets your doctor get a closer look at the lining of your stomach and take a sample to be tested for T. whipplei . You’ll get medicine to help you relax during the procedure. Treatment If tests show that you have Whipple’s disease, your doctor will give you antibiotics through an IV in your arm to kill the bacteria. They also may recommend fluids to keep you hydrated and extra vitamins and minerals to make sure you get enough nutrients. You should feel better in a couple of weeks, but it may take your small intestine up to 2 years to recover. During that time, you’ll continue to take antibiotics and supplements. If you have problems related to your nervous system, your doctor will use a combination of antibiotics, steroids , and other drugs , depending on your symptoms. Whipple’s disease can come back. You’ll need to see your doctor for regular checkups so you can treat it quickly if it does."
19,Whooping Cough (Pertussis),"What Is Whooping Cough? Whooping cough (also known as pertussis ) is a bacterial infection that affects your respiratory tract, especially your nose and throat. It causes long stretches of severe coughs that sometimes end with a whooping sound. It spreads easily, but vaccines such as DTaP (diphtheria, tetanus, and pertussis) for infants and children and Tdap (tetanus, diphtheria, and pertussis) for older children and adults can help prevent it. Before the vaccine was created, whooping cough was thought to be a childhood disease. Anyone can get whooping cough, but it generally happens more often in infants, children, and older children. Infants younger than 2 months of age, who are too young to receive the vaccine, are especially at risk. Whooping cough is milder in adults and can occur in those whose immunity has worn off. Whooping cough vs. croup Whooping cough and croup are both infections of the respiratory tract. Croup is a viral infection, while whooping cough is caused by bacteria. Croup usually runs for a shorter time frame and goes away on its own. Also, there is no vaccine for croup, and it can't be treated with antibiotics. The sounds of the coughs, which are a symptom of both conditions, are also different. Whooping cough can come with a gasping or “whooping” sound, while croup usually causes a barking cough. Whooping cough (also known as pertussis) is a bacterial infection that causes long stretches of severe coughs that sometimes end with a whooping sound. It spreads easily, but vaccines like DTaP for infants and children and Tdap for older children and adults can help prevent it. (Photo credit: E+/Getty Images) Whooping Cough Symptoms At first, whooping cough has the same symptoms as the average cold : Mild coughing Sneezing Runny nose Low fever (below 102 F) You may also have diarrhea early on. After about 7-10 days, the cough turns into “ coughing spells” that may end with a whooping sound as the person tries to breathe in air. Because the cough is dry and doesn't produce mucus , these spells can last up to 1 minute. Sometimes, it can cause your face to briefly turn red or purple. Most people with whooping cough have coughing spells, but not everyone does. Infants may not make the whooping sound or even cough, but they might gasp for air or try to catch their breath during these spells. Some may vomit. Sometimes, adults with the condition just have a cough that won’t go away. You may notice fewer symptoms after 4 weeks, but coughing bouts can come back and continue for months after symptoms start. It may last 10 weeks or more. Whooping cough sound Coughing for a long time causes you to have to take in air that you've lost. If you have whooping cough, you'll gasp after a coughing episode, which can create a whooping sound. You can still, however, have the infection without the noise. What Causes Whooping Cough? A type of bacteria called Bordetella pertussis causes whooping cough. If a person with whooping cough sneezes, laughs, or coughs, small droplets that contain this bacteria may fly through the air. You might get sick if you breathe in the droplets. When the bacteria get into your airways, they attach to the tiny hairs in the linings of the lungs . The bacteria cause swelling and inflammation , which lead to a dry, long-lasting cough and other cold-like symptoms. Can adults get whooping cough? Anyone can get whooping cough, including adults. In adults, whooping cough usually occurs in those who haven't received the vaccine or whose immunity has worn off. They also tend to have milder symptoms than children, especially those adults who've received the vaccine. Whooping cough risk factors Whooping cough can cause anyone at any age to get sick. The vaccine you received as a child wears off, so older children and adults who haven't gotten the vaccine since childhood are at risk of whooping cough. Also, because babies do not receive the vaccine until they are 2 months old, they are at risk from birth until they are vaccinated. You can get sick from it even if you've already been vaccinated, but that's not likely. If you do get whooping cough despite being vaccinated, you usually: Have symptoms that are milder and for a shorter time Have fewer coughing episodes with the whooping sound Whooping Cough Complications Whooping cough is dangerous for babies, especially those who are younger than 1 year old because it can keep them from getting the oxygen they need. This can cause: Brain damage or bleeding on the brain Pneumonia Seizures Apnea Convulsions If you think your infant might have it, see their doctor right away. Children under the age of 12 months with whooping cough should be watched at all times because the coughing spells can make them stop breathing or lead to other complications. Young babies with bad cases may need hospital care, too. Help protect your child by making sure they and any adult who's around them often get vaccinated. In teens and adults, whooping cough can lead to pneumonia. Severe coughing can also cause: Abdominal hernias Broken blood vessels Bruised ribs Trouble controlling when you pee Trouble sleeping Whooping Cough Diagnosis Because symptoms of whooping cough are a lot like those caused by a cold, the flu, or bronchitis, it can be hard to diagnose it early on. Your doctor may be able to tell that you have it by the sound of your cough, but tests can confirm it. Nose or throat culture. A simple swab of the area where your nose and throat meet can be tested for the bacteria that causes whooping cough. Blood test. A high white blood cell count is a sign that your body is fighting off an infection, but it doesn’t necessarily mean it’s whooping cough. Chest X-ray. An x-ray can show if you have inflammation or fluid in your lungs, which can be a sign of pneumonia. Whooping Cough Treatment and Home Remedies If you find out you have whooping cough early on, antibiotics can help cut down coughing and other symptoms. They can also help prevent the infection from spreading to others. But most people are diagnosed too late for antibiotics to work well. Don't use over-the-counter cough medicines, cough suppressants , or expectorants (medicines that make you cough up mucus ) to treat whooping cough. They don't work. If your coughing spells are so bad that they keep you from drinking enough fluids, you can get dehydrated. If this happens, call your doctor right away. Home remedies You can do a few things to feel better and recover faster: Get lots of rest. This can give your body more strength to fight the illness. Eat small meals as often as you feel up to it. Eating smaller, more frequent meals can help prevent the vomiting that may result from harsh coughing spells. Clean air. Keeping the air around you free of dust, smoke, and other irritants can help soothe coughing. Drink fluids. Stay hydrated by drinking lots of water or juice. If you notice signs of dehydration, such as dry lips or peeing less often, call your doctor right away. Whooping Cough Prevention Vaccines and other preventative medications can reduce the risk of spreading the infection. Whooping cough vaccine The DTaP vaccine can help protect children from whooping cough. Starting at 2 months, infants should get a dose every other month for the first 6 months, another between 15 and 18 months, and then one last time between ages 4 and 6. Older children and adults need the Tdap vaccine and a booster every 10 years because the vaccine can weaken over time. The best age for preteens to get it is between 11 and 12. Adults who’ve never had the vaccine can get it anytime and should receive a Tdap or Td booster every 10 years or after 5 years if they have a serious burn or wound. Pregnant women should get a booster during each pregnancy to help protect their newborn. The CDC recommends this during the early part of the third trimester. Some possible side effects from the vaccination include: Itching, swelling, or redness at the injection site Fever Headache Tiredness Upset stomach or vomiting Feeling nauseous Diarrhea Preventative medications Another important key to prevention is to protect the people around you. If someone in your household has whooping cough, make sure they cover their mouth or cough into their elbow to prevent the bacteria from spreading. Make sure they wash their hands often, and consider having them wear a mask when they’re near others. If you've been exposed to whooping cough, your doctor may prescribe an antibiotic to help prevent infection, particularly if: You're pregnant You live with someone who is at a high risk of having severe complications or who has whooping cough You're a health care provider You have a condition that puts you at risk for severe complications You are younger than 12 months of age Whooping Cough Outlook If you have whooping cough, you'll usually have cold symptoms for up to 2 weeks and then 10 weeks or more of coughing fits. Within another few weeks, you should slowly start to feel better as your symptoms improve. The recovery time for some may be months. Takeaways Whooping cough, also known as pertussis, is a very contagious bacterial infection of your nose and throat, or your respiratory tract. It causes long stretches of severe coughs that sometimes end with a whooping sound. The symptoms can persist for a few weeks to several months. Infants under 2 months of age are most at risk because they can't get vaccinated against whooping cough, but it also happens in older children and adults whose immunity has worn off. If you have symptoms that are similar to those of a cold, continue for more than a week, and come with coughing spells, talk to your doctor. Your doctor can prescribe antibiotics if the condition is caught early. Whooping Cough FAQs Will whooping cough go away on its own? Whooping cough is usually treated with antibiotics, and it's recommended to get treatment early to keep it from spreading and to keep your symptoms from getting severe. After having whooping cough for 3 weeks without treatment, antibiotics may not help because the bacteria is already out of your system. Your symptoms may last for months. How serious is whooping cough in adults? Symptoms from whooping cough tend to be milder in adults, especially those who have received the vaccine. Teenagers and adults can have severe cases and even serious complications, especially those who aren't vaccinated. Is whooping cough dry or wet? The cough that comes with whooping cough is dry, causes irritation, and leads to coughing fits. What does a pertussis cough sound like in adults? The “whoop ” in whooping cough is usually not present in milder cases of pertussis, and adults usually don't have severe symptoms."
20,What Is Prader-Willi Syndrome?,"Prader-Willi syndrome (PWS) is a rare, complicated condition that affects many parts of your body. It stems from a problem with one of your chromosomes (a strand of DNA that carries your genes). It can cause physical issues, like extreme hunger and weak muscles, as well as learning and behavioral problems. Only about 1 in 10,000 to 30,000 people in the world have PWS. Causes PWS usually happens because of genetic changes on a region of chromosome 15. There's no way to prevent it. But if you plan to have a baby, you and your partner can be screened for PWS risk. A head or brain injury can also cause the syndrome. Signs and Symptoms A baby may show signs of PWS early on. They may have almond-shaped eyes , their head may get narrow at the temples, their mouth might turn down at the corners, and they might have a thin upper lip. He also may have these symptoms: Poor muscle tone or limbs that hang loosely when you hold them Inability to suck or nurse well, so they gain weight slowly Eyes that cross or wander Appearance of being tired all the time Weak or soft cry Poor response to you In early childhood, kids with PWS start to show other signs. It affects a part of their brain called the hypothalamus -- this is what tells you you're full when you eat enough food. People with PWS don't get the feeling of being full, so the most common signs are nonstop hunger and weight gain. A child with PWS may always want more food, eat big portions , or try to hide or store food to eat later. Some kids even eat food that's still frozen or in the garbage. Your child may also: Be short for their age Have small hands or feet Have extra body fat and not enough muscle mass Have sex organs that may not develop Have mild to moderate learning problems Be slow to learn to talk, sit, stand, or walk Have temper tantrums Pick at their skin Have sleep problems Have mood and speech problems Have scoliosis -- a curved spine Have too little thyroid or growth hormones These signs of PWS are less common, but some people have them: Vision problems, like being nearsighted Lighter skin and hair color than the rest of the family High tolerance for pain Inability to keep body temperature under control during a fever or in a hot or cold place Thick saliva that can cause tooth decay or other problems Osteoporosis, or thin, weak bones that break easily Because their sex organs don't develop, women with PWS may never get a period. Or they may start their periods much later than others. Men who have PWS may not have facial hair. They may have small sex organs, and their voices may not change in puberty. People who have PWS usually aren't able to have children. Diagnosis Your doctor can usually diagnose PWS with a blood test called a chromosomal analysis. This shows if there's a problem with the gene that can cause PWS. Treatments There's no cure, but if you have a child with PWS, you can help them stay at a healthy weight, have a good quality of life, and prevent health problems down the road. Their treatment will depend on the symptoms. Babies : High-calorie formula may help an infant stay at a healthy weight if they can't eat well because of weak muscle tone. You also can use special nipples or a Gavage feeding tube, which puts breast milk or formula directly in your baby's stomach , to make sure they get enough food. Older kids and teens: Set clear limits on how and when your child eats to avoid too much weight gain. A low-calorie, balanced diet and lots of exercise can help them stay at a healthy weight. Some kids with PWS may need to take extra vitamin D or calcium . If your child tries to grab and hide food, you might lock cabinets, the pantry, or the refrigerator. For teens with PWS, hormones like testosterone, estrogen , or human growth hormone (HGH) may help with small stature, poor muscle tone, or extra body fat. Hormone replacement may build stronger bones and prevent osteoporosis later on. Antidepressants , like selective serotonin reuptake inhibitors (SSRIs), may help ease behavior problems caused by PWS. Specialized therapy can help your child deal with sleep apnea, thyroid issues, and other symptoms common to this condition. Kids with PWS should get regular eye exams to check for vision problems. Your child's doctor should screen for scoliosis, hip dysplasia, or thyroid problems . The Prader-Willi Syndrome Association has online support groups and tips for parents."
