,title,body
8,Burning Feet,"A burning sensation in your feet may be caused by nerve damage in the legs, also called neuropathy. Although many medical conditions can cause burning feet , diabetes is the most common. Most burning feet treatments focus on preventing further nerve damage and reducing pain. See More: What Your Feet Say About Your Health Causes of Burning Feet Most often, neuropathy is the cause of burning feet. Damaged nerve fibers are more likely to become overactive and misfire. The damaged nerves send pain signals to the brain even though there is no wound. In most people with neuropathy, the leg nerves become damaged first. These people often have tingling and numbness in the feet as well. Many people complain that their feet are overly sensitive to touch (hyperesthesia) and can have varying degrees of burning pain. It can range from mild to disabling. Diabetes and alcohol abuse are by far the most common causes of neuropathy in the legs. Many other conditions can cause neuropathy or a burning sensation in the feet: Chronic kidney disease (uremia) Small fiber neuropathy Vitamin deficiency ( vitamin B12 , folate, and occasionally vitamin B6 ) Alcohol abuse Low thyroid hormone levels ( hypothyroidism ) Lyme disease HIV /AIDS Amyloid polyneuropathy Drug side effects, including chemotherapy drugs, vitamin B6 overdose, HIV medicines, amiodarone , isoniazid , metformin , and others Erythromelalgia Heavy metal poisoning (lead, mercury, arsenic) Vasculitis ( inflammation of blood vessels) Sarcoidosis Guillain -Barre syndrome (GBS) Chronic inflammatory demyelinating polyneuropathy (CIDP) Besides neuropathy, infections and inflammation of the feet can also cause a burning sensation. The most common of these is athlete's foot , an infection of the skin caused by fungus. Peripheral artery disease (PAD) also commonly causes burning feet. The poor circulation of blood to the feet may frequently cause pain , tingling, and burning feet, especially while walking. Weeks or months after gastric bypass surgery , some people experience a burning feet sensation. Poor absorption of B vitamins after gastric bypass can cause neuropathy in the legs and a sensation of burning feet. Diagnosing Burning Feet Most people who have burning feet have a likely cause (such as diabetes ) that can be identified. For these people, the diagnosis of burning feet due to neuropathy is straightforward, and additional testing is not needed. In a few people whose burning sensation is sudden, rapidly worsening, or has no explainable cause, further testing may be needed to make a correct diagnosis. These tests may include: Electromyography (EMG). A test of muscle function using recordings of electrical activity inside the muscles. A probe may be placed on the skin, or a needle may be inserted into the muscle, for an EMG test. Nerve conduction study. A nerve conduction study tests the ability of nerves to transmit impulses. A nerve is stimulated, and the response in the muscle controlled by that nerve is measured. Laboratory tests. Sometimes, tests of blood, urine, or spinal fluid may be suggested to help diagnose the cause of burning feet. Vitamin levels can be checked with a simple blood test. Nerve biopsy . Very rarely, a doctor may suggest cutting out a piece of nerve tissue and examining it under a microscope. Treatments for Burning Feet The most important treatment for burning feet due to neuropathy is to stop any ongoing nerve damage . In some cases treatment of the underlying disease will improve the neuropathy and symptoms. In other situations, like a small fiber neuropathy, where no cause can be identified, the physician will focus on treating the person’s symptoms. For people with diabetic neuropathy , treatment means keeping blood sugar levels in the normal range. This usually requires dietary changes, oral medications , and often insulin injections. For people with other forms of neuropathy that cause burning feet, preventing further nerve damage is equally important. Specific conditions and their treatments include: Vitamin deficiency. Taking additional vitamin B12 orally or by injection can replace low levels of this nutrient. Alcoholism . Stopping excessive drinking prevents ongoing nerve damage and allows nerves to heal. Chronic kidney disease. Dialysis may be necessary to eliminate toxins causing neuropathy and burning feet symptoms. Hypothyroidism . Taking oral thyroid hormone raises low thyroid levels, often reversing neuropathy as well as burning feet symptoms. GBS and CIDP. Treatments are very specialized and include plasma exchange ( plasmapheresis ) or immune globulin therapy (IVIG). Burning feet treatments include treating the pain and abnormal sensations created by neuropathy. Some commonly prescribed medications for burning feet include: amitriptyline carbamazepine ( Tegretol ) desipramine ( Norpramin ) duloxetine ( Cymbalta ) gabapentin ( Neurontin ) pregabalin ( Lyrica ) topiramate (Topamax) venlafaxine ( Effexor XR ) Other pain medications may be necessary to reduce the severe discomfort some people experience from burning feet. Over-the-counter medicines like Advil , Aleve , Motrin IB, and Tylenol control pain in many people with burning feet. Prescription pain relievers like tramadol ( Ultram ) or low-dose opiates (narcotics) may be necessary for severe pain. For burning feet caused by athlete's foot, antifungal drugs can cure the fungal infection and relieve burning feet symptoms. Over-the-counter medicines like miconazole ( Micatin ) or terbinafine ( Lamisil AT) should be used first. Prescription antifungals like fluconazole ( Diflucan ), itraconazole (Sporanox), and naftifine ( Naftin ) are also available."
9,Cellulitis,"What Is Cellulitis? Cellulitis is a common infection of the skin and the soft tissues underneath. It happens when bacteria enter a break in the skin and spread. The infection causes swelling, redness, pain, or warmth in the skin. Cellulitis is a bacterial infection that can develop from a break or cut in your skin. (Photo Credit: iStock/Getty Images) Most often cellulitis affects the lower legs. It can be in the face, arms, and other parts of the body, too. Cellulitis can be serious if bacteria get into the bloodstream. Erysipelas vs. cellulitis Erysipelas is another type of skin infection. Both erysipelas and cellulitis cause the same symptoms -- swollen, red, warm skin. The two conditions can be hard for even doctors to tell apart. One difference is that cellulitis affects deeper layers of skin than erysipelas. Lymphedema and cellulitis The lymphatic system is a network of vessels that's part of your immune system. These vessels carry a fluid called lymph that flushes bacteria out of your body to prevent infections. Lymphedema is swelling under the skin caused by a buildup of lymph fluid. It happens when damage or a blockage in the lymphatic system prevents lymph fluid from draining. You're more likely to get cellulitis if you have lymphedema. That's because a damaged lymph system can't protect you as well against infections. Cellulitis Causes Cellulitis happens when there's a break in the skin and bacteria get inside. It usually shows up on damaged skin such as inflamed wounds, dirty cuts, and areas with poor blood circulation. Although many different types of bacteria cause cellulitis, the two most common types are Group A Streptococcus and Staphylococcus aureus . These bacteria live on your skin and underneath your fingernails. Bacteria get into a cut or tear in the skin from: An injury Surgery A skin condition such as eczema, athlete's foot, or psoriasis Foreign objects in the skin Open wounds underneath the skin Is cellulitis caused by poor hygiene? Breaks in the skin are the most common cause of cellulitis, but it can happen in areas that aren't clean. To lower your risk, wash your hands with soap and water before you touch your skin. Shower regularly and put on clean clothes. And clean any wounds to prevent bacteria from getting inside. Is cellulitis contagious? Cellulitis isn't contagious. Usually, it doesn't pass from one person to another. The only way it might spread this way is if one person has an open wound that directly touches another person's open wound. Types of Cellulitis Common parts of the body affected by cellulitis are your legs, feet, and toes, as well as your arms, hands, and fingers. Doctors also label types of cellulitis based on where the infection starts, including: Periorbital cellulitis This is an infection of the eyelid or the skin around the eye. It's most common in children. The cause is often an injury or sinus infection. Periorbital cellulitis usually isn't serious. Most children with this infection get better after they take antibiotics for about a week. Orbital cellulitis Orbital cellulitis is less common than the periorbital type, but it can be more serious. Like periorbital cellulitis, it starts when bacteria spread from an injury or sinus infection into the eye. But in this case, the bacteria get deeper into the fat and muscles of the eye. Orbital cellulitis can cause blindness without treatment. Perianal cellulitis This infection mainly affects children under 10. It starts in the perineum, the area between the anus and the scrotum in boys, or between the anus and vulva in girls. Strep bacteria most often cause perianal cellulitis. Facial cellulitis Cellulitis can affect the face, although a skin infection on the face is more likely to be from erysipelas. Facial cellulitis happens when bacteria spread to the face from a(n): Ear infection Gum infection Injury Insect bite Sinus infection Breast cellulitis Breast cellulitis is an infection of the breast. It happens when bacteria build up in the sweat underneath the breasts. The skin of the breast becomes red, warm, and swollen. Some people also have flu-like symptoms such as a fever and chills. You're more likely to get breast cellulitis if you: Are overweight Have large breasts Had surgery or radiation therapy to treat breast cancer Cellulitis in the breast can spread quickly if you don't treat it. Cellulitis from a bug bite Insects don't transmit the bacteria that cause cellulitis through their bites or stings. However, the break in your skin from a bite or sting gives the bacteria a way to enter your body and cause an infection. The bacteria that cause cellulitis live on your skin and in your nose and mouth, even if you're healthy. Cellulitis Symptoms Cellulitis symptoms usually start with a small area of skin that's red, swollen, tender, and warm. The skin may be pitted like an orange peel or develop blisters. You may have a fever and chills. Other common symptoms include: A sore or rash that grows quickly Warmth Pain or tenderness Tiredness Yellow, clear fluid or pus leaking from the area Get medical help for any of these more serious symptoms: High fever (100.4 F or higher) Nausea and vomiting Shaking chills (rigors) Growing or hardening of the reddened area Increased pain Numbness when you touch the area Dizziness Confusion Cellulitis Risk Factors You’re more likely to get cellulitis if you: Have an injury to the skin Have a weak immune system from diabetes , cancer such as leukemia, or HIV/AIDS Have c irculatory problems, such as insufficient blood flow to your arms and legs, poor drainage of your veins or lymphatic system ( lymphedema) , or varicose veins -- twisted, enlarged veins near the surface of the skin Had chickenpox or shingles Had cellulitis in the past Have a skin condition such as eczema , psoriasis , or athlete's foot Have liver disease such as chronic hepatitis or cirrhosis Are overweight Had a coronary artery bypass graft procedure Cellulitis Diagnosis Often doctors can diagnose cellulitis based on how the skin looks. Your doctor will ask about your symptoms and examine your skin. You might need a blood test to rule out other conditions with similar symptoms. Other procedures could include: An X-ray. This is used to see if there’s a foreign object in your skin or if the bone underneath is possibly infected. A bacterial culture. Your doctor will use a needle to remove fluid from the area and send it to the lab. Cellulitis Complications Rarely, the infection can spread and cause complications such as: Bacteremia, a blood infection Endocarditis, an infection of the inner linings of the heart's valves and chambers Osteomyelitis, a bone infection Sepsis, an extreme whole-body response to infection Toxic shock syndrome, a life-threatening condition caused by bacterial toxins Suppurative arthritis, an infection in a joint Necrotizing fasciitis, an infection that destroys tissue under the skin Get medical help right away if you have cellulitis along with any of the following symptoms: A large area of skin that's red and inflamed Numbness, tingling, or other changes in the affected area Skin that has turned black A red and swollen area around your eyes or behind your ears Cellulitis Treatment While treating cellulitis, the goal is to get rid of the bacteria that caused the infection. Usually, the way to do that is with antibiotics. Cellulitis antibiotics Cellulitis treatment usually includes an antibiotic such as dicloxacillin or cephalexin, which you take by mouth for 5-10 days. Which antibiotic you need will depend on what type of bacteria caused your cellulitis. Take the full course of antibiotics, even if you feel better. You may need to take antibiotics for 7-14 days or longer if you have a weakened immune system. Some people need more than one type of antibiotic. You may get treatment in a hospital if: Cellulitis doesn't get better after a few days of taking antibiotic pills It covers a large area of your body You have a weak immune system The infection is around your eyes The hospital can give you antibiotics right into one of your veins (IV treatment). You may need to stay in the hospital for a few days if you have a serious case of cellulitis. Cellulitis home remedies Take care of your wound. Keep it covered to help it heal faster. Your doctor will let you know if you need to put special dressings or medicines on the infected area. Here are some other ways to manage cellulitis at home: Prop up the part of your body with cellulitis. This will relieve swelling and help the infection heal. Hold a warm compress to your skin in the affected area. Wear a compression wrap or stocking to bring down swelling and improve blood flow. Ask your doctor if you can take an over-the-counter nonsteroidal anti-inflammatory drug (NSAID) pain reliever such as ibuprofen (Advil, Motrin), aspirin, or naproxen (Aleve) to keep you comfortable. Cellulitis Surgery Most of the time, antibiotics are enough to treat cellulitis. Surgery usually isn't necessary, unless your doctor needs to open and drain an abscess or remove pus that has collected in the tissue. They may also cut away dead tissue to help the area heal. Cellulitis Prevention Use these tips to avoid cellulitis: Practice good personal hygiene, and keep your skin clean. Rub a lotion or moisturizer onto your skin to prevent cracks. Wear sturdy, well-fitting shoes or slippers with loose-fitting cotton socks. Don’t walk barefoot outdoors. Keep wounds clean. Wash the wound every day with soap and water and cover it with a fresh, clean bandage. Watch for signs of infection such as redness and pus. Trim your nails carefully to avoid injury. If you have diabetes, check your feet every day for sores you might not feel. Quickly treat any injuries or infections. Manage conditions that can cause cellulitis, such as eczema, athlete's foot, and lymphedema. To prevent insect bites, use an insect repellent approved by the Environmental Protection Agency (EPA). Wear a long-sleeved shirt and pants when you go outside in areas where there are biting insects. Clean insect bites with soap and water. Apply an antibiotic ointment if the skin is broken. Cover the bite with a bandage to keep it clean and prevent you from scratching. Some injuries are more likely to cause cellulitis than others. See your doctor if you have: Animal or human bites Puncture wounds deeper than a half-inch, such as from stepping on a nail Crushed tissue that bleeds Burns that blister Frostbite Deep injuries with dirt in them Injuries that touch seawater (making them more prone to infection), especially if you have liver disease Diabetes or other major medical conditions, such as liver or kidney disease Swelling in your arms and legs that does not go away Cellulitis Outlook Cellulitis should go away after you take antibiotics for 7-10 days. You may need to take antibiotics for longer if the infection is serious. In rare cases, cellulitis can spread through the bloodstream and cause more serious problems, such as a heart infection or blood infection. You may need treatment in a hospital if that happens."
10,Idiopathic Thrombocytopenic Purpura,"Background Idiopathic thrombocytopenic purpura (ITP), also known as primary immune thrombocytopenic purpura and autoimmune thrombocytopenic purpura, is defined as isolated thrombocytopenia with normal bone marrow and in the absence of other causes of thrombocytopenia. ITP has two distinct clinical syndromes, manifesting as an acute condition in children and a chronic condition in adults. Pathophysiology ITP is primarily a disease of increased peripheral platelet destruction, with most patients having antibodies to specific platelet membrane glycoproteins. Relative marrow failure may contribute to this condition, since studies show that most patients have either normal or diminished platelet production. Acute ITP often follows an acute infection and has a spontaneous resolution within 2 months. Chronic ITP persists longer than 6 months without a specific cause. Epidemiology Frequency United States Incidence rates are as follows: The incidence of ITP in adults is approximately 66 cases per 1,000,000 per year. An average estimate of the incidence in children is 50 cases per 1,000,000 per year. New cases of chronic refractory ITP comprise approximately 10 cases per 1,000,000 per year. International According to studies in Denmark and England, childhood ITP occurs in approximately 10-40 cases per 1,000,000 per year. A prospective, population-based study in Norway indicated an incidence of 53 per 1,000,000 in children younger than 15 years. A study in Kuwait reported a higher incidence of 125 cases per 1,000,000 per year. Mortality/Morbidity Hemorrhage represents the most serious complication; intracranial hemorrhage is the most significant. The mortality rate from hemorrhage is approximately 1% in children and 5% in adults. In patients with severe thrombocytopenia, predicted 5-year mortality rates from bleeding are significantly raised in patients older than age 60 and those under age 40 -- 47.8% versus 2.2%, respectively. Older age and previous history of hemorrhage increase the risk of severe bleeding in adult ITP. Spontaneous remission occurs in more than 80% of cases in children. However, it is uncommon in adults. Age See the list below: Peak prevalence occurs in adults ages 20-50. Peak prevalence occurs in children ages 2-4. Approximately 40% of all patients are younger than age 10. Sex- and Age-related Demographics In chronic ITP (adults), the female-to-male ratio is 2.6:1. More than 72% of patients older than age 10 are female. In acute ITP (children), distribution is equal between males (52%) and females (48%). In adults, the peak prevalence is from ages 20 to 50. In children, peak prevalence is from ages 2 to 4. Approximately 40% of all patients are younger than age 10. Return to the Thrombocytopenia and ITP Guide"
11,Wernicke-Korsakoff Syndrome,"What Is Wernicke-Korsakoff Syndrome? Wernicke-Korsakoff syndrome (WKS) is one name for two conditions that often happen together -- Wernicke encephalopathy and Korsakoff syndrome. Many doctors think of them as different stages of the same disease. They can happen if you don’t get enough vitamin B1, also called thiamine. Vitamin B1 helps your brain turn sugar into energy. When your brain and nervous system don’t get the amount they need, they don’t work as well. Wernicke encephalopathy typically comes on suddenly, and you’ll need treatment right away. Symptoms include confusion, loss of muscle coordination, and trouble with your vision . Korsakoff syndrome happens more slowly. It’s a long-term, ongoing problem that damages the part of your brain that handles memory. Wernicke-Korsakoff Syndrome Symptoms The main signs of Wernicke encephalopathy are: Balance and movement issues. You might have leg tremors, and your walk might become slow and unsteady, with a wide stance and short steps. You may need help standing and getting around, and your arms and legs might feel weak. Confusion. You may feel out of it and lose interest in what’s happening around you. Eye problems . You may have double vision , your eyelids might droop, or your eyes may move around quickly. You also may have problems with your heart and blood vessels that can lead to: Drowsiness Fainting A faster heartbeat than normal Low blood pressure when you stand up A lack of energy If you aren’t treated for Wernicke encephalopathy quickly, it can lead to Korsakoff syndrome. Symptoms of Korsakoff syndrome usually begin as the signs of Wernicke encephalopathy start to go away. The telltale sign is the loss of short-term memory. That also makes it hard for you to learn anything new or make new memories. You might talk to someone and seem like yourself. But a minute or two later, you won’t remember anything about it, not even who you spoke with. You may also have: Some long-term memory loss The urge to make up stories without knowing it to fill in any gaps Hallucinations A hard time putting words into context Trouble understanding or processing information Wernicke-Korsakoff Syndrome Causes and Risk Factors In many cases, the lack of vitamin B1 is caused by heavy, long-term alcohol use. Over time, alcohol affects how well your body absorbs, stores, and uses it. It also can happen if you don’t get enough nutrients from your diet or if you have certain health problems. These other causes include: Some diseases that affect your whole body, like cancer , AIDS , or serious infections Eating disorders , like anorexia Serious kidney problems Chemotherapy treatment for cancer Some stomach conditions Throwing up often and over a long period of time Weight loss surgery , also known as gastric bypass Men get Wernicke-Korsakoff syndrome a little more often than women, and it typically happens in people ages 45-65. It's also more common in: People who are homeless Older adults living alone People with serious mental health conditions These groups are more likely to abuse alcohol or not eat well. Wernicke-Korsakoff Syndrome Diagnosis Typically, it’s based on a physical exam , your health history, and some tests. Your doctor will also want to rule out other problems that could cause your symptoms. You may get: Blood tests to see how much thiamine is in your system and how well your liver and kidneys are working Imaging scans of your brain to rule out problems like a tumor or stroke An eye exam to check your eye movement A mental health exam Tests to check your brain and nervous system Tests to look at changes in how you walk Wernicke-Korsakoff Syndrome Treatment The first step is to get plenty of vitamin B1. You’ll probably have it put directly into a vein through a needle in your hand or arm (an IV). You might need to have this every day for several months. From there, it’s important to stay away from alcohol and eat a balanced diet . That’ll help keep symptoms from coming back. If it affects how you walk, you’ll likely need physical therapy . Wernicke-Korsakoff Syndrome Complications Korsakoff syndrome typically can’t be reversed. In serious cases, it can cause brain damage and lead to problems with memory and your walk that don’t go away. Wernicke-Korsakoff Syndrome Outlook Your recovery will depend mostly on how early you started treatment. If you catch and treat it early, you can make a full recovery, but it could take up to a year. Confusion and issues related to it are often the last symptoms to go away."
