,title,body
40,What Is Geographic Tongue?,"[""What Is Geographic Tongue? Geographic tongue is a condition that causes red patches to form on your tongue or in other areas of your mouth. It gets its name because the patches look like a map. Doctors sometimes call it benign migratory glossitis . The patches can come and go and change shape. Their duration can range from a few days to several years. Geographic tongue affects about 1%-3% of people. It's benign, which means it’s harmless. It isn't linked to an infection or cancer . It isn’t contagious, so you can’t catch it from or pass it to someone else. It often doesn't have symptoms and usually goes away on its own."", ""Geographic Tongue Symptoms The main symptom of geographic tongue is the presence of uneven red patches on the top, sides, and underside of your tongue. It's rare, but they might also be on your gums, inside your cheeks, or on the roof of your mouth. These patches may: Have a white or light-colored border Change in size, shape, and color Start in one area and then move to another Be smooth, unlike the small bumps (papillae) that usually cover your tongue"", ""You may not know that you have geographic tongue until your dentist or doctor spots it during a mouth exam. It's not common, but some people with geographic tongue might have a burning or painful feeling. This is often because of things such as: Hot, spicy, or acidic foods Cigarette smoke Toothpaste You might also have swollen lymph nodes under your jaw."", ""Geographic Tongue Causes Doctors aren't sure what causes geographic tongue. It might be linked with certain health issues, such as: Eczema and psoriasis Some types of arthritis Type 1 diabetes Geographic tongue tends to run in families, so it might also have something to do with your genes. Also, not having enough of these nutrients might cause geographic tongue: Iron Zinc Folic acid Vitamins B6 and B12 Other things that might cause it are stress, hormone changes, and allergies. Geographic tongue is also linked to a condition called fissured tongue, which causes grooves to form on the tongue. Doctors don't know what causes a fissured tongue, but it's more common in older adults."", 'Geographic Tongue Risk Factors Geographic tongue can happen at any age, but it’s more likely in young adults. It’s also more common in women than in men. Other things that raise your risk of geographic tongue: Eczema Psoriasis Type 1 diabetes Certain types of arthritis A family history of geographic tongue Not having enough iron, zinc, folic acid, and vitamins B6 and B12 Having a fissured tongue Taking hormonal birth control A lot of stress Allergies', 'Geographic Tongue Diagnosis Your dentist or doctor will ask about your symptoms and look at your mouth and tongue. During the exam, your doctor might: Ask you to move your tongue in different directions Touch your tongue to feel changes in the texture Check for any tenderness See if there are any signs of infection, such as swollen lymph nodes in your neck You may need tests to rule out other medical conditions.', 'Geographic Tongue Treatment Any pain or discomfort will probably get better on its own. But if you have severe, constant pain, medication can help. Your doctor or dentist may prescribe: Over-the-counter pain relievers Anti-inflammatories Mouth rinses with anesthetic Corticosteroids that you put on your tongue Zinc supplements It also helps to limit or avoid things such as: Tobacco Hot, spicy, or acidic foods or dry, salty nuts Toothpaste with additives (such as sodium lauryl sulfate), whitening agents, or heavy flavoring (toothpaste for sensitive teeth is a better choice)']"
41,Burning Mouth Syndrome,"[""What Is Burning Mouth Syndrome? Burning mouth syndrome is the name for burning pain in your mouth that doesn’t have a known cause. Most often, the pain is on the tip of your tongue or roof of your mouth . But sometimes it's in the front of your mouth or on the inner part of your lips. It often lasts for many years. About a third of people who have burning mouth syndrome say it started after some kind of dental work, an illness, or a course of medication. But most can't link it to any unusual event."", ""Symptoms of Burning Mouth Syndrome If you have burning mouth syndrome, your mouth can feel like you just drank hot coffee or had some hot soup. It feels different for each person. In general, burning mouth syndrome symptoms can include: Burning feeling on the tongue, roof of the mouth, gums, inside of the cheeks, and in the back of the throat, which may be relieved with eating or drinking Numbness or tingling of the tongue, which can come and go Trouble swallowing Dry mouth Sore throat Changes in taste, such as a bad taste of metal in your mouth The pain may get worse throughout the day. If the burning doesn't go away or gets worse, see your dentist or doctor."", 'Causes of Burning Mouth Syndrome Burning mouth syndrome is grouped as primary or secondary, depending on the cause. Primary burning mouth syndrome The burning pain can’t be explained by a lab test or other health condition. You might also hear primary burning mouth syndrome called idiopathic burning mouth syndrome. Doctors think the cause could be damage to nerves that control taste or pain. Secondary burning mouth syndrome Sometimes, burning mouth syndrome results from another health event or condition. In this case, it’s called secondary burning mouth syndrome. Causes of secondary burning mouth syndrome include: Acid reflux (acid from your stomach comes back up into your mouth) Allergic reaction to materials used in dentures Anxiety or depression Changes in hormones due to the thyroid disease, diabetes, or menopause Dry mouth resulting from diseases or treatments; for example, Sjogren’s syndrome and radiation therapy Medications used to treat blood pressure Dentures don’t fit well Lack of iron, vitamin B12, or folic acid Reaction to certain toothpastes or mouthwashes Stress Thrush (a yeast infection in your mouth)', 'Risk Factors for Burning Mouth Syndrome Burning mouth syndrome is more common in women than men. You might be more likely to get it if you’re: A woman between ages 50-70 Going through menopause', ""Burning Mouth Syndrome Diagnosis Your doctor will want to know about your symptoms and when they began. They'll also ask if you have allergies , take any medications , or smoke or drink often. The doctor will examine your mouth and check for infection. You may need several tests to rule out other medical issues. These include: Allergy test to see if you have a reaction to a product or medication Biopsy (the doctor removes a small piece of tissue from your mouth and sends it out for tests) Blood tests to see if you have thyroid problems or diabetes CT scan (several X-rays are taken from different angles then put together to show a more complete picture) MRI (powerful magnets and radio waves combine to make detailed images) Salivary flow tests to measure your saliva"", ""Burning Mouth Syndrome Treatment If the doctor finds a health problem or other cause for your burning mouth, you have secondary burning mouth syndrome. They’ll treat the issue, and your symptoms should get better. If not, there's no known cure for burning mouth syndrome, but there are ways to ease and control your symptoms. Depending on the cause of your burning mouth syndrome, the doctor may suggest one or more of these treatments: Medicines that help with nerve-related pain such as amitriptyline ( Elavil ) and nortriptyline ( Aventyl, Pamelor ) Capsaicin , a pain reliever made from hot peppers Clonazepam (Klonopin), taken in low doses Female hormone replacement Mouth rinses Products that replace your saliva Vitamin supplements You can do a few things that may help your symptoms as well: Avoid acidic foods like tomatoes and orange and citrus juices. Avoid alcohol , including mouthwashes with alcohol. Avoid cinnamon and mint. Avoid spicy foods. Avoid tobacco . Chew sugar -free gum (so you'll make more saliva). Drink a lot of fluids. Reduce stress with yoga or hobbies. Stay socially active or join a pain support group. Suck on crushed ice."", 'Complications of Burning Mouth Syndrome Burning mouth syndrome is a chronic pain condition and can affect your quality of life. It may take many doctor visits to diagnose the condition. The pain may last for months, even years. Some people have pain every day. The pain may make you feel depressed, stressed, or anxious, making it hard to do everyday activities and sleep. Any type of chronic pain can lead to anxiety which is known to cause sleeping problems.']"
42,Arthritis Supplements,"['Many people with arthritis -- especially osteoarthritis -- use supplements in their diet to ease the pain of arthritis . Glucosamine and chondroitin are the most well-known. Methyl sulfonylmethane (MSM) is another supplement used to ease the pain of arthritis, but it has not been through as much scientific testing. It is important to check with your doctor before starting any new treatments. Your doctor can review the other medications you are taking and help you decide whether or not these arthritis supplements are right for you. In addition, always follow the instructions on the medication label. Do not take more of the supplements than is recommended.', 'What Are Glucosamine and Chondroitin? Glucosamine and chondroitin sulfate are components of normal cartilage. In the body, they are the building blocks for cartilage and appear to stimulate the body to make more cartilage. There are conflicting studies on glucosamine and chondroitin, some demonstrating a beneficial effect on osteoarthritis pain. Others, including the NIH-sponsored multicenter Glucosamine/Chondroitin Arthritis Intervention Trial (GAIT), did not show benefit for the primary outcome of reducing pain. More recently another study also found that glucosamine did not slow down cartilage damage or reduce knee pain.', 'The supplements, which are available in pharmacies and health food stores without a prescription, are well-tolerated and appear to be safe. However, there are no long-term studies to confirm their long-term safety and effectiveness. Keep in mind that the U.S. Food and Drug Administration (FDA) regulates supplements, but treats them like food rather than drugs; supplement manufacturers are not required to prove their products are safe or effective before selling them in the marketplace . Many physicians may still recommend a trial of glucosamine at this point, and if there is not apparent improvement by three months, it would be reasonable to stop glucosamine. Research is ongoing.', ""Which Brand of Arthritis Supplement Should I Use? There are many different brands of glucosamine and chondroitin, which are usually sold together as one arthritis supplement. Again, there is no government monitoring to ensure the purity of these products. In order to assure that you get a consistent dose of the supplements, stick with a reputable manufacturer; choose products sold by large and well-established companies. If you don't recognize a brand name, ask about the company's reputation, how long it has been in business, and how long the store has stocked the brand."", 'Who Should Not Take These Arthritis Supplements? People with diabetes should use caution when taking glucosamine because it may raise blood sugar. People taking blood -thinning medication (anticoagulants) should check with their doctors before taking glucosamine and chondroitin. These arthritis supplements may also have a blood -thinning effect, so people taking these supplements in addition to an anticoagulant may have to have their blood tested more often. People who are allergic to shellfish also should consult their doctors before using glucosamine and chondroitin. Glucosamine is extracted from a substance in shellfish. The effects of these supplements on a growing child or developing baby are not yet known. For that reason, glucosamine and chondroitin are not recommended for children, women who are pregnant, women who are nursing, and women who could become pregnant.', 'What Are the Side Effects of Glucosamine and Chondroitin? These arthritis supplements are generally well-tolerated. However, side effects can occur. The most commonly reported side effects of glucosamine and chondroitin include: Nausea Diarrhea or constipation Heartburn Increased intestinal gas', 'What Is MSM and Can It Help My Arthritis? MSM, or methylsulfonylmethane, is a supplement that is used to try to help a wide range of conditions, including arthritis, allergies, and even snoring . MSM is an odorless and tasteless natural sulfur compound found in all living things. Sulfur is needed by the body for healthy connective tissue and joint function and has purported pain-quashing and anti-inflammatory properties. While MSM is found in many foods -- including meat, fish, certain fruit, vegetables, and grains -- it is destroyed when foods are processed. MSM supplements have become increasingly popular in recent years and many people feel they have had some pain relief since taking MSM. Although some studies have reported improvement in pain with MSM, more research needs to be done to support its use as an arthritis supplement. Those patients with multiple health conditions should be aware that current prescription medication may interact with dietary supplements , and they should consult their doctor so that side effects can be best monitored. Moreover, as with many supplements that have not been studied, the long-term benefits and safety of the chemical are unknown. Talk to your doctor before taking MSM.', 'What Are the Side Effects of MSM? MSM is considered very safe, and side effects are rare. Side effects that have been reported include: Diarrhea Skin rash Headache Fatigue']"
43,Goiter,"[""What Is a Goiter? A goiter is an enlargement of your thyroid gland . That's the gland at the front of your neck just below your Adam's apple. It may be a temporary problem that will get better without treatment. Or it can be a symptom of another, possibly serious, thyroid condition that requires medical attention."", 'Types of Goiters Since many things can make your thyroid swell, there are lots of types of goiters. A few of them are: Simple goiters , which happen when your thyroid gland doesn\'t make enough hormones. The thyroid grows larger to make up for this. Endemic goiters. Sometimes called colloid goiters, these are caused by a lack of iodine in your diet . Your thyroid uses iodine to make its hormones. Few people get this kind of goiter in countries where iodine is added to table salt, like the United States. Sporadic or nontoxic goiters , which usually have no known cause. Certain drugs and medical conditions can trigger them. Multinodular goiters , which happen when lumps called nodules grow in your thyroid. A goiter is described as ""toxic"" when it\'s linked to hyperthyroidism . That means your thyroid makes too much thyroid hormone . A ""nontoxic"" goiter doesn\'t cause ether hyperthyroidism or hypothyroidism (not enough thyroid hormone).', 'Goiter Symptoms The symptoms of a goiter include swelling at the front base of the neck, ranging from a small lump or multiple nodules to a general enlargement on one or both sides of your neck. You may also have: A hoarse voice Tightness in your throat Dizziness when you raise your arms Swollen neck veins Coughing Trouble breathing or swallowing If you have a toxic goiter with hyperthyroidism, you might have: Sweating Diarrhea Nausea A fast pulse or heartbeat Shakiness or hand tremors Weight loss despite an increased appetite High blood pressure An overheated feeling Nervousness Muscle weakness If you have hypothyroidism, you could notice: Dry skin Tiredness Weight gain Constipation An irregular period Slowed physical and mental functions Depression A lower heart rate A cold feeling Tingling or numbness in your hands', ""Goiter Causes and Risk Factors Goiters don't represent any one disease. They can form quickly or very slowly over years. Before iodized salt was introduced in 1920, iodine deficiency was the main cause of goiters in the U.S. It still is worldwide."", ""In the U.S., the main causes of goiters are autoimmune disorders (including Graves' disease or Hashimoto's disease ) and multinodular goiter. Inflammation of the thyroid, called thyroiditis , can also cause a goiter. You can get this after getting sick from a virus or after giving birth . Risk factors for goiters include: Age. You're at higher risk if you're over 40. Gender. Women are more likely to have goiters and thyroid disorders overall. Pregnancy or menopause, both of which are linked to thyroid issues History of autoimmune disease Some medications , including lithium (used for mood disorders ) and amiodarone (for irregular heartbeat ) Exposure to radiation , such as cancer treatments Living in an area where iodine deficiencies are common"", ""Goiter Diagnosis Often, your doctor will diagnose your goiter simply by examining your neck. You may then have tests to find out what caused it and how it affects you. They include: An ultrasound to see how large your thyroid is and whether you have nodules Blood tests to measure your thyroid hormone levels and see whether you have the antibodies that some goiters cause. Antibodies are proteins your body makes to fight infection. A biopsy , where your doctor uses a thin needle to take a sample of tissue or fluid for testing. This is used to rule out cancer. A thyroid scan , in which your doctor injects a little radioactive material to create an image of your thyroid on a computer screen. This shows your doctor the size of your thyroid and how well it's working. A CT scan or MRI if your goiter is large or has spread to your chest"", 'Goiter Treatment A goiter may not need treatment, especially if it is small and thyroid hormone levels are normal. But if your thyroid hormone levels are too high or too low, you will need treatment.', ""Treatment involves getting the thyroid hormone levels back to normal. Depending on what caused your goiter and how serious it is, your doctor can treat it with: Medication. If you have hypothyroidism, your doctor may prescribe a thyroid hormone replacement medication. When the medication takes effect, the thyroid may begin to return to its normal size. But a large nodular goiter with a lot of internal scar tissue will not shrink with treatment. For goiters caused by inflammation , you might take aspirin or corticosteroids. Surgery. If the goiter is uncomfortable, causes overproduction of thyroid hormone unresponsive to medications , is large enough that it causes symptoms because of its size, or becomes cancerous, the entire thyroid gland may have to be surgically removed. Or they might take out only part of it. Afterward, you may need to take thyroid hormone medicine for the rest of your life. Radioactive iodine. You take this in a pill to treat an overactive thyroid. It kills cells to shrink the thyroid. After this treatment, you'll probably need to take hormone drugs from then on. If you have a goiter, your doctor may want to check it on a periodic basis with ultrasound to be sure that it isn’t growing larger or developing suspicious looking nodules that might call for a fine-needle biopsy."", 'Call Your Doctor About a Goiter If: You should call the doctor if you experience any of the above symptoms with a goiter because you may have hyperthyroidism or hypothyroidism that needs treatment. Goiters are slow-growing, but if you have a large goiter and notice shortness of breath or voice changes, you should call the doctor. The goiter may be pressing on your jugular vein, windpipe, esophagus , or the nerve that runs to your larynx. The growth requires treatment and may need to be surgically removed.']"
44,What Is Autoimmune Thyroiditis?,"[""Your thyroid is a small gland in front of your neck that makes hormones that help control just about every organ. When your thyroid\xa0hormone levels are too high or too low, your body can't work right.\xa0That can affect your energy level, mood, and weight. If your thyroid becomes inflamed, you have thyroiditis . Sometimes it happens because your body makes antibodies that attack your thyroid by mistake. This condition is called autoimmune thyroiditis, chronic lymphocytic thyroiditis, Hashimoto ’s thyroiditis, or Hashimoto’s disease."", 'Causes Doctors don’t fully understand why your immune system misfires this way. It could be set off by a faulty gene, a virus, or something else. Or it could be a combination of causes.', 'Could You Get It? You may be more likely to get autoimmune thyroiditis if you: Are a woman Are middle-aged Have another autoimmune disorder like lupus , type 1 diabetes , or rheumatoid arthritis Are related to someone who has autoimmune thyroiditis Have been exposed to environmental radiation', 'Symptoms You may not have any in the beginning. As the disease goes on, your thyroid may become enlarged, a condition called a goiter. The front of your neck will look swollen, and it might make your throat feel full. The thyroid may or may not be tender to the touch. A damaged thyroid can’t do its job, which leads to hypothyroidism -- too little of the thyroid hormones. Symptoms can include: Tiredness Sensitivity to cold Puffy face Trouble pooping Enlarged tongue Pale, dry skin and brittle nails Hair loss Weight gain Muscle aches and joint pain Depression Memory lapse Heavy menstrual bleeding', 'Diagnosis Your doctor will order blood tests to check your thyroid hormone levels. The tests also look for something called thyroperoxidase antibodies. You also might have an ultrasound so your doctor can look at your thyroid, especially if your blood test results aren’t clear. Your doctor might spot the problem through regular blood tests even if you don’t have any symptoms, especially if they’re aware that your family has a history of thyroid problems.', 'Treatment The usual therapy is a prescription medicine called levothyroxine (Levo-T, Levothroid , Levoxyl , Synthroid , Tirosint, Unithroid ). It’s a man-made version of what a healthy thyroid makes. Your doctor will keep an eye on you and may have to adjust your dosage every once in a while. You’ll need to take medicine for the rest of your life. Some foods, like a high-fiber diet or soy products, can mess with levothyroxine. You should also let your doctor know if you take: Iron supplements A cholesterol medicine called cholestyramine ( Locholest , Prevalite , Questran ) Antacids that have aluminum hydroxide An ulcer medicine called sucralfate ( Carafate ) Calcium supplements']"
