,title,body
12,West Nile Virus Questions Answered,"WebMD has answers to some common questions about West Nile virus . 1. How do people get infected with West Nile virus (WNV)? People get West Nile virus from the bite of a mosquito that has fed on an infected bird. Mosquitoes can't transmit the virus from one person to another. It's also possible to get West Nile virus from a blood transfusion or an organ transplant from an infected donor. Since all blood donated in the U.S. is tested for the virus, the blood supply in this country is considered safe. 2. What are the symptoms of West Nile virus infection? Four out of five people infected with West Nile virus don't have any symptoms. A few of these people may develop lingering infections that might cause problems years later. But most will become immune to the virus and never get a West Nile illness. One in five infections results in West Nile fever. Once considered a relatively mild illness, the CDC now says people with West Nile fever can be quite ill for quite a long time. The symptoms of West Nile fever include: Fever Headache Fatigue Skin rash on the trunk of the body (in some cases but not in others) Swollen lymph glands (in some cases but not in others) Eye pain (in some cases but not in others) In one in every 150 infections, the virus gets into the brain ( encephalitis ) or into the tissues covering the brain and spinal cord ( meningitis ). This is what the CDC calls ""neuroinvasive"" West Nile disease. About 10% of people who get West Nile encephalitis or West Nile meningitis die. Most people with neuroinvasive disease have either encephalitis or both encephalitis and meningitis. Some 25% to 35% get meningitis only. The symptoms of West Nile meningitis include: Fever Headache Stiff neck The symptoms of West Nile encephalitis include: Changes in consciousness ranging from mild (sluggishness) to severe (mental confusion, convulsions, or coma ). Fever and headache . Neurological symptoms, including paralysis of one or more limbs or palsy, may occur. Tremors and movement problems sometimes occur. Some people with West Nile infection become weak or paralyzed in one or more limbs. Two-thirds of these people are left with permanent weakness or paralysis. It's not yet clear what percentage of people with neuroinvasive West Nile disease get this syndrome, known as West Nile poliomyelitis. 3. How is West Nile virus treated? There is no specific treatment for West Nile virus infection. More severe cases require intensive hospital care. 4. What are the risks of West Nile virus infection for pregnant women? There have been a few miscarriages among women infected during pregnancy, but it's not clear whether the virus played a role. Most women known to have been infected with West Nile virus during pregnancy have given birth to normal, uninfected babies. While pregnant women appear not to be at particularly high risk from West Nile infection, uncertainties remain. The CDC advises pregnant and nursing women to take special care to avoid mosquito bites. 5. Should I continue breastfeeding if I have symptoms of West Nile virus? At least one woman appears to have passed West Nile virus to their child during breastfeeding . This appears to happen only rarely. The benefits of breastfeeding far outweigh the potential risk of West Nile infection to an infant. 6. What are the chances of dying from West Nile virus infection? The odds of getting the most severe forms of West Nile disease are about one in 150. The overall death rate in severe disease is about 10%. That makes the overall odds of dying from a West Nile infection about one in 1,500. These odds aren't the same for everyone. People over age 50, especially those who are elderly, are more likely to suffer severe consequences from West Nile infection. 7. How does West Nile virus actually cause severe illness and death in humans? West Nile virus causes severe disease when it crosses the blood/ brain barrier and infects the brain and spinal cord. The virus disturbs normal brain function -- including disruption of the nerve impulses needed for breathing -- which can be fatal. 8. Should people avoid donating blood or getting blood transfusions or organ transplants? Blood is lifesaving and often in short supply. Donating blood is safe, and we encourage blood donation now and in the future. Approximately 4.5 million persons receive blood or blood products annually. Although persons needing blood transfusions or organ transplants should be aware of the risk for WNV infection, the benefits of receiving needed transfusions or transplants outweigh the potential risk for WNV infection. 9. How do health care providers test for West Nile virus? If your doctor suspects you have a West Nile virus infection, they will send a sample of your blood to a lab for tests. The most common tests look for antibodies against the virus, showing that you've recently been infected. If you have symptoms of more severe disease, your doctor may perform a spinal tap to collect spinal fluid. As with blood, the spinal fluid sample is sent to a lab for tests. 10. Who is at risk for getting West Nile virus infection? Mosquitoes carrying West Nile virus are found in all of the lower 48 states. Mosquitoes are most plentiful in late summer. West Nile season usually peaks in August and September. People who spend a lot of time outdoors are at highest risk of infection. The mosquitoes that transmit West Nile virus are most active at dawn and dusk. Being outdoors during those hours increases the risk of infection. People over age 50 are more likely to develop symptoms of West Nile disease, but it's not clear whether older people are more susceptible to infection. Infants are not at higher risk of West Nile virus infection. And pregnancy does not increase a woman's risk of infection. 11. Can you get West Nile encephalitis from another person? No. West Nile encephalitis is not transmitted from person to person. For example, you cannot get West Nile virus from touching or kissing a person who has the disease or from a health care worker who has treated someone with the disease. 12. Where did West Nile virus come from? West Nile virus was first detected in the U.S. in New York City in 1999. It is not known where the U.S. virus originated but it is most closely related to strains found in the Middle East. 13. Is West Nile virus seasonal in its occurrence? In the U.S., West Nile virus cases occur primarily in the late summer or early fall. In southern climates, where temperatures are milder, West Nile virus can be transmitted year-round. 14. Is there a vaccine available to protect humans from West Nile virus? No. However, vaccines have been made against similar viruses, so a West Nile vaccine appears possible. 15. If I live in an area where birds or mosquitoes with West Nile virus have been reported and a mosquito bites me, am I likely to get sick? No. Even in areas where the virus is circulating, very few mosquitoes are infected with the virus. Even if the mosquito is infected, less than 1% of people who get bitten and become infected will get severely ill. The chances you will become severely ill from any one mosquito bite are extremely small. 16. If a person contracts West Nile virus, does that person develop a natural immunity to future infection by the virus? It is assumed that immunity will be lifelong; however, it may wane in later years. 17. If my dog/cat becomes infected with West Nile virus, does it pose a risk to the health of my family or other animals? While cats and dogs can get West Nile infections, they cannot spread the virus to people."
13,West Syndrome,"What Is West Syndrome? West syndrome is a type of epilepsy that affects babies. It’s named after the doctor who discovered it. Experts have many names for it, including: Infantile spasms (IS) Epileptic spasms X-linked infantile spasm syndrome X-linked infantile spasms Tonic spasms with clustering Hypsarrhythmia Lightning spasms Generalized flexion epilepsy Infantile epileptic encephalopathy Infantile myoclonic encephalopathy Massive myoclonia Salaam or jerk knife spasms What Are the Symptoms of West Syndrome? West syndrome causes seizures. They last only a few seconds, but they happen in bunches called clusters. There can be as many as 150 seizures in a cluster, and some babies can have up to 60 clusters a day. Sometimes, they don’t happen in clusters at first. Children with West syndrome may have other symptoms such as: Crankiness Loss of appetite Changes in sleep patterns, such as sleeping more during the day and less at night Acting like they can’t see Slowed development Regression What Are West Syndrome Causes and Risk Factors? This condition is rare. It affects fewer than 6 babies out 10,000. Most infants get it before they’re a year old, usually between months 4 and 8. A little over half of babies who have West syndrome are boys. Things that can cause West syndrome include: Changes in your child’s genes Metabolic disorders Unusual brain development or formation Brain injury from a lack of oxygen Other brain injuries Brain infection What Are the Types of West Syndrome? Your doctor may talk about three kinds of West syndrome, depending on the cause: Symptomatic. Another condition caused West syndrome, and your baby’s doctor knows what it is. Cryptogenic. The doctor thinks another condition caused it but doesn’t know for sure. Idiopathic. Your baby was developing the way they should before West syndrome, and the cause isn’t known. How Is West Syndrome Diagnosed? If your child’s doctor suspects West syndrome, they’ll ask for detailed information about your child’s seizures. Try to take a video before the appointment so you can show them what the seizures look like. This can help your doctor figure out if it’s West syndrome, which is often mistaken for colic. If your child is having seizures, they’ll need an electroencephalogram (EEG) to record the patterns of electrical activity in their brain. These patterns can show the difference between West syndrome and other seizure disorders. Your child may have these tests: Your doctor will do an EEG with your child awake. If the first EEG doesn’t show the expected brain pattern, they may do another one while your child is sleeping. An MRI or CT scan could show where in your child’s brain the seizures are happening. They also can rule out other conditions. Urine, blood, or cerebrospinal fluid (CSF) tests can help to find the cause. These may include gene tests. What Is the Treatment for West Syndrome? Treatments can help control the seizures. These may include: Medication The most common treatment for West syndrome is medication. Your doctor may want to try: ACTH, a hormone Vigabatrin (Sabril), a seizure medication Steroids like prednisone Vitamin B6 , if West syndrome results from a lack of vitamin B About two-thirds of babies who take ACTH or vigabatrin have fewer or less intense seizures. It may be a day or two before these treatments work. Medications like ACTH, vigabatrin, and steroids can have side effects, so you and your doctor will have to balance the good and the bad for your child. The side effects of these drugs include: Weakened immune system High blood pressure Digestive issues Crankiness Sugar in the urine Vigabatrin side effects include: Crankiness Permanent change in vision Sleepiness Shaking Throwing up Constipation Bellyache If these medications don’t work, your doctor might want to try: Benzodiazepines like Clobazam (Onfi) Rufinamide (Banzel) Topiramate ( Qudexy XR, Topamax, Topiragen, Trokendi XR ) Valproic acid (Alti-Valproic, Depakene, Depakote, Stavzor ) Zonisamide ( Zonegran ) Ketogenic diet Your baby’s doctor may suggest a ketogenic diet -- one that’s high in fats and low in carbohydrates. It isn’t something you should try to do by yourself. The doctor will want you to work with a nutrition specialist. You’ll still be able to breastfeed , but you’ll also have to use a ketogenic formula. The doctor may want to admit your baby to the hospital to start the process. The ketogenic diet can have side effects, like kidney stones , dehydration , and constipation. You and the doctor will have to watch your little one closely. Surgery If brain scans show lesions on your baby’s brain, they might need surgery. Your doctor might suggest a corpus callosotomy , which is sometimes called split-brain surgery. The corpus callosum is a band of nerve fibers deep inside the brain that connects the two halves. During this procedure, the surgeon will cut it so that seizure signals on one side of the brain can no longer travel to other side. Your baby may still have seizures, but they won’t be as intense. This surgery can also treat a common cause of West syndrome, tuberous sclerosis complex . In this condition, cancerous tumors grow in your baby’s body, including the brain. Some people with this condition do better with a type of surgery called resection, in which the doctor removes parts of the brain that are causing seizures. If your child has developmental delays , other types of therapies and assistance may help. These may include occupational therapy and postural aids. West Syndrome Outlook Usually, the spasms stop by the time a child is 4 years old. But most people who have West syndrome will have other kinds of epilepsy or seizure conditions when they’re older. West syndrome can affect your child’s development and ability to think. How severe their problems are depends on what caused the condition and how they were developing before they got it: If they were on track before, they may keep their mental ability or only have a mild disability. If their West syndrome came from a brain disorder or an injury, they're likely to have more serious problems. Babies with West syndrome usually have mental disabilities or trouble learning later in life, but up to 1 in 5 will have typical mental skills or only mild mental disabilities. About 7 in 10 babies with West syndrome have severe mental disabilities. They might get autism , especially if the syndrome came from tuberous sclerosis complex, a condition that causes noncancerous tumors in the body and brain. Or they could be hyperactive, which means it’ll be hard for them to sit still or concentrate. It’s rare, but some children who had West syndrome as babies will die before adulthood. It usually happens before the age of 10. Your baby is more likely to develop normally if: They were at least 4 months old before they got West syndrome. Their seizures aren’t unusual for West syndrome. They don’t have partial seizures. Their readings from an EEG -- which measures electrical activity in the brain -- are normal. (They don’t have what doctors call asymmetry.) They get treated soon after their diagnosis. Treatment gets their seizures under control quickly. In the Long Term The future depends on what caused your baby’s West syndrome. If it's from an injury, infection, or a condition like tuberous sclerosis complex, they may not fare as well. If there wasn’t another cause and their development was on track before it, their chances of a normal life are a little bit better than 50-50. The odds are even higher if they get treatment within a month of getting West syndrome. About 1 in 4 babies who have it will develop normally and be able to have a job when they grow up. How to Get Support Parents of children with West syndrome can find -- or give -- help via the Infantile Spasms Project, an online forum run by the David Geffen School of Medicine at the University of California, Los Angeles."
14,Acute Respiratory Distress Syndrome (ARDS),"What Is Acute Respiratory Distress Syndrome? Acute respiratory distress syndrome (ARDS) is a condition that causes fluid to build up in your lungs so oxygen can’t get to your organs. Fluid leaks from small blood vessels and collects in tiny air sacs in your lungs so they can’t fill with enough air. Because of this, your blood can’t pick up the oxygen it needs to carry to the rest of your body. Organs such as your kidneys or brain might not work the way they should or might shut down. ARDS is sometimes life-threatening and can get worse quickly. But it’s generally treatable, and most people recover. Fast diagnosis and treatment are important. ARDS Causes and Risk Factors ARDS is usually triggered by another health problem, so most people who have it are already in the hospital for something else. Causes of ARDS include: Sepsis . This is when you get an infection in your bloodstream and your immune system goes into overdrive, causing inflammation , small blood clots , and bleeding. Accidents. Injuries from a car wreck or a fall can damage your lungs or the part of your brain that controls breathing . Breathing in harmful things. Dense smoke or chemical fumes can trigger ARDS. Other possible causes of ARDS include: Pneumonia Bleeding that makes you need a transfusion Inflamed pancreas Drug overdose Near- drowning Burns Reactions to medications Breathing food into your lungs ( aspiration ) Doctors don’t know why some people get ARDS and others don’t. Risk factors include: A problem in your genes Heavy alcohol use Smoking tobacco Using oxygen for a lung condition Recent high-risk surgery or chemotherapy Obesity ARDS Symptoms ARDS puts a lot of strain on your lungs. Symptoms include: Shortness of breath Low blood pressure Unusually fast breathing Fast heartbeat Cough Fever Chest pain , especially when breathing deeply Confusion and exhaustion Blue-tinted lips or nails from lack of oxygen in your blood Dizziness ARDS Diagnosis and Tests No single test can identify ARDS. It’s more of a puzzle that your doctor pieces together. They’ll want to rule out conditions that can have similar symptoms. Your doctor will ask about your medical history, do a physical exam , and listen to your breathing and your heartbeat. They may also look for: Signs of extra fluid in your body Bluish color on your lips or skin Tests to help with diagnosis include: Imaging tests. A chest X-ray is crucial and probably the first test your doctor will order. You might also have a CT scan . These can give your doctor an idea of how much fluid is in your lungs and where it is. Blood tests. These check your oxygen level. They can also look for signs of infection or anemia , a lack of red blood cells. Heart tests . These can rule out conditions such as heart failure (when your heart doesn’t pump blood through your body the way it should). ARDS Treatment Treatment aims to get the oxygen levels in your blood up to where they should be, so your organs get what they need. In some cases, your doctor might give you an air mask and later go to a breathing tube and ventilator (a machine that helps you breathe). Your doctor will also treat other conditions that might be causing ARDS. Treatments include: Nutrition and medicine through fluids injected into your blood Medication to prevent bleeding and blood clots Medication to keep you calm and comfortable Most ARDS treatment is done in a hospital’s intensive care unit. Many people have a full recovery with no long-term problems. ARDS Complications The condition or its treatment can lead to other problems, including: Collapse of part of your lung because it can’t inflate the way it should ( atelectasis ) or because of air between your lung and your chest wall (pneumothorax) Organ damage or failure Confusion High blood pressure in the artery that goes from your heart to your lungs ( pulmonary hypertension ) Scarred lung tissue (pulmonary fibrosis) Blood clots Infection ARDS Outlook If you’ve recently had ARDS, improve your recovery by: Not smoking Not drinking alcohol Getting a flu shot every year and a pneumonia vaccine as directed by your doctor You might need to be on a ventilator for a while. ARDS can leave you weak, so you may go to physical therapy to get stronger. ARDS can be emotionally and physically tough on patients and families. A support group may help with anxiety , stress , or depression ."
15,What Is Wolf-Hirschhorn Syndrome?,"It can be very hard to learn that your child has Wolf-Hirschhorn syndrome, also known as 4p- syndrome. Naturally, you have a lot of questions about what caused it and how it can be treated. Wolf-Hirschhorn is a rare genetic disorder that your baby gets when part of chromosome 4 is deleted. It happens when cells divide abnormally during reproduction. When any part of a chromosome is missing, it can damage normal development. The deleted chromosome 4 causes the features of Wolf-Hirschhorn, including facial features like wide-set eyes , a distinct bump on the forehead, a broad nose, and low-set ears. Each case is different, because the amount of symptoms depends on how much of the chromosome is deleted. What Causes It? Doctors don’t really know what causes this spontaneous genetic change that occurs during a baby’s development. The “broken” chromosome usually isn’t inherited from either parent; the deletion typically occurs after fertilization. Doctors do think that three different genes can be deleted from chromosome 4, and all are important to early development. Each missing gene causes a separate set of the condition’s symptoms. For example, one is linked to abnormalities of the face, while another seems to trigger the seizures that affect nearly all children with Wolf-Hirschhorn. Sometimes though, Wolf-Hirschhorn syndrome is caused when one of the parents has something called a “balanced translocation.” That mean two or more of their chromosomes broke and switched spots during their development. It usually doesn’t cause any symptoms in that parent since the chromosomes are still balanced. But it raises the odds that person will have a child with a chromosomal disorder, including Wolf- Hirschhorn. You can get a genetic test to see if you have balanced translocation. What Are the Symptoms? Wolf-Hirschhorn affects many parts of the body, both physical and mental. The most common symptoms are abnormalities of the face, delayed development, intellectual disabilities, and seizures. Other problems your baby could have include: Bulging, wide-set eyes Droopy eyelids and other eye problems Cleft lip or palate Downturned mouth Low birth weight Microcephaly , or an unusually small head Underdeveloped muscles Scoliosis Heart and kidney problems Failure to thrive How Is It Diagnosed? Sometimes your doctor can find the physical signs of Wolf-Hirschhorn syndrome with routine ultrasounds during your first trimester of pregnancy . Or chromosome issues could show up in what’s known as an expanded cell-free DNA screening test. But these are both just screenings, not diagnostic tests. Your doctor will need to do more tests to know whether your baby has Wolf-Hirschhorn. One test that can detect more than 95% of chromosome deletions in Wolf-Hirschhorn is called a “fluorescence in situ hybridization” (FISH) test. Tests done after your baby is born also can identify the partial deletion of the chromosome. If your doctor confirms your child has Wolf-Hirschhorn, they may suggest several imaging tests to fully understand all affected areas of your baby’s body. You and your partner also should be tested if you plan to have more children in the future. How Is It Treated? There is no cure for Wolf-Hirschhorn syndrome, and every patient is unique, so treatment plans are tailored to manage the symptoms. Most plans will include: Physical or occupational therapy Surgery to repair defects Support through social services Genetic counseling Special education Controlling seizures Drug therapy"
