,title,body
0,"H. pylori Infection: Symptoms, Causes, Diagnosis, and Treatment","What Is H. pylori? H. pylori is a type of bacteria that infects your stomach and can cause issues like ulcers. (Photo credit: Thinkstock / Getty Images) Helicobacter pylori ( H. pylori ) is a type of bacteria that infects your stomach. It can cause sores and inflammation in the lining of your stomach or the upper part of your small intestine (the duodenum). For some people, an infection can lead to stomach cancer . Infection with H. pylori is common. About two-thirds of the world’s population has it in their bodies. For most people, it never causes any symptoms. But it's the most common cause of peptic ulcers, which are painful open sores in your digestive tract. In rare cases, it could even lead to stomach cancer. How Do You Get H. pylori? H. pylori bacteria usually spread from person to person and also likely through: Dirty food, water, or utensils Mouth to mouth (kissing) Contaminated poop or vomit Once H. pylori enters your body, it multiplies in the lining of your stomach. This weakens the lining, making it more likely that your stomach acids will cause an ulcer. Is H. pylori contagious? Yes. You can get H. pylori if you have contact with the saliva or other body fluids of someone who is already infected. H. pylori Risk Factors Most people get H. pylori during childhood, but adults can get it, too. Infections are often related to your living conditions. Risk factors include: Crowded living conditions Lack of clean water and sewer service Living in close quarters with someone who is infected Living in a developing country H. pylori Symptoms Just having the bacteria doesn't cause symptoms. But you'll probably notice them if you get stomach inflammation (gastritis) or a peptic ulcer due to H pylori . The most common issue is a dull or burning pain in your belly. The feeling may come and go, and may worsen when your stomach is empty. You may feel better after you eat, drink milk, or take an antacid. Other symptoms include: Bloating Burping No appetite Nausea Vomiting Weight loss for no clear reason What does H. pylori poop look like? Most people infected with H. pylori will have normal-looking poop. But if yours looks dark, black, tarry, or has any blood in it, call your doctor right away. When to Get Emergency Help Sometimes, peptic ulcers bleed into your stomach or intestines. This can be dangerous. Call your doctor right away if you have any of these symptoms: Bloody, dark red, or black poop Trouble breathing Dizziness or fainting Pale skin Vomit that is bloody , black, or looks like coffee grounds Serious, sharp stomach pain An H. pylori infection is also a risk factor for stomach cancer , which has few symptoms at first. Call your doctor if you have any of these signs: Belly pain or swelling Bloating Nausea Loss of appetite Feeling full after you eat just a small amount Vomiting Weight loss for no reason Black poop H. pylori Diagnosis Depending on your symptoms, your doctor will likely ask you about your medical history and any medicines you take. Then they’ll give you a physical exam , which may include checking your belly for swelling, tenderness, or pain. H. pylori tests There are several tests your doctor can use to find out if you're infected with H. pylori , including: Stool tests Stool antigen tests detect proteins (antigens) related to H. pylori in your poop. They're the most common tests used to find the bacteria. Stool PCR tests (polymerase chain reaction tests) look for H. pylori in your poop. They also look for mutations that can make the bacteria antibiotic-resistant. PCR tests are more expensive than antigen tests and may not be as easy to get. Urea breath test During this test, you exhale into a bag so your doctor can measure how much carbon dioxide is in your breath. Then you swallow a liquid or pudding that contains a substance called urea. Several minutes later, you'll exhale into a different bag to measure your carbon dioxide again. The two bags are sent to a lab for comparison. If you have H. pylori in your gut, it will break down the urea in the liquid you swallowed, and carbon dioxide will be released in your breath. If there's more carbon dioxide in the second sample than the first, your test is positive for H. pylori . To look more closely at your ulcers, your doctor may use: Upper gastrointestinal endoscopy . Your doctor uses a tube with a small camera, called an endoscope, to look down your throat and into your stomach and the upper part of your small intestine. The procedure may also be used to collect a sample that will be checked for H. pylori. You may be asleep or awake during the procedure, but you’ll get medicine to make you more comfortable. Upper GI tests. In a hospital, you’ll drink a chalky white liquid that contains a substance called barium, and your doctor will give you an X-ray. The barium coats your throat and stomach and makes them stand out clearly on the image. Computed tomography (CT) scan. This powerful X-ray can be used to detect stomach conditions like peptic ulcers. H. pylori Treatment Ulcers caused b y H. pylori are usually treated with a combination of antibiotics and a proton pump inhibitor (PPI). Triple therapy : Therapies that combine PPIs with two antibiotics remain the first-line options for treating H. pylori . Antibiotics : Your doctor will probably prescribe two antibiotics to keep the bacteria from building up a resistance to a particular one. Amoxicillin , clarithromycin ( Biaxin ), metronidazole ( Flagyl ), tetracycline ( Sumycin ), or tinidazole ( Tindamax ) are likely options. Proton pump inhibitors (PPIs) : These drugs reduce the acid in your stomach by blocking the tiny ""pumps,"" or glands, that produce it. They include esomeprazole ( Nexium ), lansoprazole ( Prevacid ), omeprazole ( Prilosec ), pantoprazole ( Protonix ), and rabeprazole ( Aciphex ). Bismuth subsalicylate: This medication, often used as an over-the-counter diarrhea remedy, is often recommended along with antibiotics to further protect your stomach. Histamine (H-2) blockers : These block the chemical histamine , which prompts your stomach to make more acid. These include cimetidine ( Tagamet ), and nizatidine ( Axid AR ). H-2 blockers are only used when you can't take PPIs. Triple therapy for H. pylori There are two common types of these three-medication treatments: Rifabutin-based triple therapy, which includes two antibiotics (amoxicillin and rifabutin) and a PPI (omeprazole) that you take together every 8 hours for 14 days. This triple therapy is available as one pill, approved by the FDA in 2019 under the brand name Talicia. Clarithromycin triple therapy also has two antibiotics (clarithromycin and amoxicillin or metronidazole) plus a PPI. This is usually an option in cases where the H. pylori strain has low resistance to clarithromycin. If any of your medications bother you, talk to your doctor about your treatment options and how you can handle side effects. Most ulcers caused by H. pylori will heal after a few weeks. Don't take nonsteroidal anti-inflammatory drugs (NSAIDs) like aspirin, ibuprofen, and naproxen for pain, since they can damage your stomach lining. If you need pain medicine, talk to your doctor. Your doctor may retest you for H. pylori about 4 weeks after you finish your treatment. If you still show signs of an infection, you might need to take another round of different antibiotics. H. pylori Complications H. pylori commonly causes inflammation to the lining of your stomach (gastritis). You don't always have symptoms from gastritis, but the irritation and swelling it causes can lead to discomfort, nausea, and vomiting. Peptic ulcers are the most common complication of H. pylori . About 10% of those infected with the bacteria will get one. A serious one could: Block digested food from leaving your stomach Leave a hole in the wall of your stomach Cause bleeding It’s not common, but an untreated long-term H. pylori infection is a risk factor for some types of stomach cancer . The disease has few symptoms at first, such as heartburn. Over time, you may notice: Belly pain or swelling Nausea Not feeling hungry Feeling full after you eat just a small amount Vomiting Weight loss for no reason Call your doctor if you show any of these signs. If you have a history of stomach cancer in your family, your doctor may recommend testing for H. pylori. Prevention You can protect yourself from getting an H. pylori infection the same ways you keep other germs at bay: Wash your hands thoroughly after you use the bathroom and before you prepare or eat food. Teach your children to do the same. Avoid eating food or drinking water that’s not clean. Don’t eat anything that isn’t cooked thoroughly. Avoid food served by people who haven’t washed their hands. H. pylori diet While the main risk factors for H. pylori infection are poor sanitation and hygiene practices, research shows that what you eat also may play a role. One study found that people whose diets were high in fresh fruits and vegetables, whole grains, nuts, and seeds had lower risks of H. pylori infection. But those whose diets were full of carbohydrates, processed grains and meats, sugars, and salt were more likely to have H. pylori infections. This could be because some compounds like vitamin C, polyphenols, and flavonoids in the first group's diet help protect the stomach lining and prevent the bacteria from establishing. But we need more research to know for sure. Takeaways H. pylori is a common type of bacteria that attacks the stomach lining. It's usually passed from person to person. Most infections are harmless. But the bacteria is to blame for most peptic stomach ulcers, and if it's not treated, it could be a risk factor for stomach cancer. The most effective treatments include a combination of antibiotics and proton pump inhibitors. H. pylori FAQs Is H. pylori a serious infection? Most people infected with H. pylori don't have any problems. But the bacteria can do serious damage to your stomach lining and is the leading cause of peptic ulcers. In rare cases, it can lead to stomach cancer. Can H. pylori be easily cured? You can treat the symptoms of an H. pylori infection with antibiotics, proton pump inhibitors (PPIs), and H-2 blockers. Treatment takes about 2 weeks. Once the bacteria are gone, there's little chance the infection will return if you follow good hygiene practices."
1,Hereditary Angioedema (HAE),"What Is Hereditary Angioedema? Hereditary angioedema is a rare genetic condition that causes swelling under the skin and lining of the gut and lungs. It can happen in different parts of your body. You are born with hereditary angioedema (HAE). Although you’ll always have it, treatment helps you manage it. There have been big improvements in treatment, and researchers continue to look for new solutions. Symptoms most often initially show up in childhood and get worse during the teen years. Many people don't know HAE is causing their swelling until they're adults. Where you have it on your body, how often the bouts happen, and how strong they are different for everyone. The attacks can come and go as well as move to different spots during the same bout. The swelling typically goes away on its own but can also occur as a life-threatening event. Your throat can swell. That can cut off your airways and could be deadly. So if you know you have HAE and you feel any change like that, call 911 right away. The frequency of attacks can vary. You can have attacks as often as every 1 to 2 weeks or 1 to 2 per year, and they can be hard to manage. Causes With this disease, a certain protein in your body is not in balance. This causes tiny blood vessels to push fluid into nearby areas of your body. That leads to sudden swelling. A problem with a gene that makes a blood protein called C1 inhibitor often causes HAE. In most cases, you don’t have enough of this protein. In others, you have normal levels but it doesn't work right. For the most common form of HAE, if one of your parents has HAE, you have a 50% change of having it, too. But sometimes the gene change happens for unknown reasons. If you have the broken gene, you can pass it on to your children. Symptoms The main symptom is swelling. You won’t have the itching or hives that people often get with allergic reactions. A bout may last 2 to 5 days. It can happen in different parts of the body: Mouth or throat Hands Feet Face Genitals Belly Swelling in the throat is the most dangerous symptom. Puffiness in the feet and hands can be painful and make it hard to go about your daily life. Swelling in your belly can cause: Extreme pain Nausea Vomiting Diarrhea You may notice warning signs before swelling begins. These may include: Extreme fatigue Muscle ache Tingling Headache Belly pain Hoarseness Mood changes Triggers Although you may not be able to tell what your triggers are, common ones include: Stress or anxiety Minor injury or surgery Illnesses such as colds or flu Physical activities such as typing, hammering, or pushing a lawn mower Medications, including some used for high blood pressure and congestive heart failure Women may notice a difference in the number or sharpness of attacks when they: Have their period Are pregnant. For some women, it doesn't happen as often when they’re pregnant, but then the attacks come back after they give birth. Use birth control or hormone replacement therapy containing estrogen. Women usually say they have more and worse attacks while on these medicines. Getting a Diagnosis If you've had symptoms of HAE, your doctor may ask: What changes have you noticed? Where have you had swelling? How often? Have you had any in your face, neck, tongue, or throat? Have you noticed any changes that happen before swelling begins? Have you had any stomach problems or stomach surgery? Does anyone in your family have a problem with swelling? Have you or anyone in your family been treated for allergies? The right diagnosis is key. Sometimes people are treated for allergies when it's really HAE that causes their swelling. Antihistamines and corticosteroids that treat allergies don’t work well for this disease. You can have severe stomach swelling, pain, and diarrhea and severe dehydration and if misdiagnosed, it can lead to surgery you don't need. Your doctor will do a physical exam. You'll need blood tests, too, to confirm that it’s HAE. If you do have it, ask your doctor to refer you to a specialist familiar with the condition. You should also ask your doctor about having other members of your family tested, even if no one has symptoms. Questions for Your Doctor Do I need more tests? What can I expect from this condition? Which treatments do you recommend? What are their side effects? What should I do if my throat swells? How likely is that? How can I find out what triggers my attacks? Will I pass this condition on to my children? Should my family get tested for HAE? Will this affect my plans to have a family? Treatment Doctors can use medications to treat or prevent attacks: Berotralstat (Orladeyo) C1 esterase inhibitor ( Berinert , Cinryze , Haegarda) Conestat alfa ( Ruconest ) Ecallantide ( Kalbitor ) Icatibant ( Firazyr ) Lanadelumab-flyo ( Takhzyro ) You may also need oxygen or IV fluids to ease your symptoms. Your doctor will make recommendations for what you need. Taking Care of Yourself Learn as much as you can about HAE so you can make informed decisions about your treatment and medications that you should be cautious with. If you can figure out your triggers, you can better avoid them. It helps to track your attacks and symptoms in a journal and look for patterns. Talk to your doctor before you have any dental work. They may want you to take medication to avoid a flare. Also talk with your doctor before you take any new prescription medicines. There is a chance they could trigger an attack. Carry your medical information with you at all times. If your child has HAE, note any changes in behavior that you see before an attack. As they get older, they'll need to learn their triggers and treatment needs. Make sure all caregivers and family members know about the condition and what to do if an attack happens. Remember: Any swelling in the throat is an emergency. Take your medication for attacks and call 911. Connect with others who are living with HAE. They can share their insights and tips to help you manage your symptoms. What to Expect There's no cure for HAE, but new treatments have made it possible for people to manage their symptoms and enjoy active lives. Getting Support To learn more about HAE and to find the support of others who have it, visit the website of the U.S. Hereditary Angioedema Association at www.haea.org."
