,title,body
36,  How to Manage and Treat Rosacea,"What Is Rosacea? Rosacea is a skin condition that makes your skin look flushed or red. You may also have small bumps with pus inside. It can look similar to acne or other skin problems. Symptoms differ based on the color of your skin. Flushing and blushing are often more obvious on light skin, but harder to see on brown or Black skin. This might make it harder for people with darker skin to get the right diagnosis. Even if you don't see obvious redness, you may have rosacea if your skin has: Small red bumps Bumps that contain pus Stinging, burning, and sensitivity Your doctor can suggest medicine and other treatments to manage your symptoms. You can also take steps at home to help yourself get better. Who’s most likely to have rosacea? R osacea can affect anyone, but some groups are more likely to get the condition, including: Middle-aged and older adults Women Light-skinned people, but doctors may overlook it in people with darker skin because this skin tone can hide discolored skin Rosacea Types There are four types of rosacea. But you can have symptoms of more than one type. The types of rosacea are: Erythematotelangiectatic rosacea. With this type, you have long-lasting redness on your face. Small blood vessels under your skin get larger and more visible. Your symptoms often come and go. Without treatment, the redness can get worse or even become permanent. Papulopustular rosacea. This causes pus-filled ""whiteheads"" as well as swollen red bumps that look a lot like acne. Often, they show up on your forehead, cheeks, and chin, but they can also affect your scalp, chest, or neck. Your face may also be red or flushed. If you have a serious case, these symptoms can take a while to get better. Phymatous rosacea. With this rare type, your skin gets thick and scarred. This form of rosacea most often affects your nose and can make it look swollen, bumpy, and sometimes discolored. Ocular rosacea. This type of rosacea affects your eyes, causing them to feel irritated and look bloodshot or watery. Your eyes become dry and sensitive, and you may get cysts on your eyelids. Rosacea on the face When rosacea appears on your face, your skin will look more flushed. You may also see broken blood vessels (called spider veins) and pus-filled bumps . Erythematotelangiectatic, papulopustular, and phymatous are all types of rosacea that appear on the face. Rosacea Symptoms For people with lighter skin, the main thing you may notice is redness on your cheeks, nose, chin, and forehead. Less often, the color can appear on your neck, head, ears, or chest. After a while, broken blood vessels might show through your skin, which can thicken and swell. Up to half of people with rosacea also get eye problems like redness, swelling, and pain. Rosacea can look like some other diseases, so it's important to get a diagnosis. The redness is more obvious on lighter skin. If your skin is darker, it might be harder to get the right diagnosis. (Photo credit: iStock/Getty Images) Other symptoms you may get no matter what your skin tone include: Stinging and burning of your skin Red or pus-filled bumps that may resemble pimples Patches of rough, dry skin A swollen, bulb-shaped nose Larger pores Broken blood vessels on your eyelids Bumps on your eyelids Problems with your vision Is rosacea itchy? This doesn't always happen, but rosacea can sometimes cause an itchy or tight feeling. Rosacea symptoms can come and go. They might flare up for a few weeks, fade, and then come back. Treatment for rosacea is a must, so see your doctor. If you don't take care of it, your symptoms can get worse and might become permanent. Rosacea Triggers Common triggers for rosacea include: Sun exposure Very hot or very cold weather Alcohol Very hot or spicy foods Intense exercise Stress Some cosmetic, skin, or hair products In addition, menopause and some drugs may cause flushing. To help identify your triggers, keep a diary of when symptoms appear, what you were doing, the environmental conditions, and what you think may have brought on your symptoms. Discuss this with your doctor. Rosacea Causes Doctors don't know exactly what causes rosacea. A few things that may play a role are: Your genes. Rosacea often runs in families. Blood vessel trouble. The redness on your skin might be due to problems with blood vessels in your face. Sun damage could make them get wider, which makes it easier for people to see them. Mites. They're microscopic insects. A type called Demodex folliculorum normally lives on your skin and usually isn't harmful. Some people, though, are more sensitive to the mites, or more of the mites than usual. Too many mites could irritate your skin. Bacteria. A type called H. pylori normally lives in your gut. Some studies suggest this germ can raise the amount of a digestive hormone called gastrin, which might cause your skin to look flushed. Some things about you may make you more likely to get rosacea. For instance, your chances of getting the skin condition go up if you: Have light skin, blond hair, and blue eyes Are between ages 30 and 50 Are female (or were designated as female at birth) Have family members with rosacea Had severe acne Smoke Rosacea Treatment There isn't a cure for rosacea, but treatments can help you manage the redness, bumps, and other symptoms. Your doctor can choose from among several types of medicines to treat it. Rosacea creams and other medicines applied to the skin Drugs you apply to your skin (called topicals) can help fight acne and inflammation and/or kill bacteria. They include: Azelaic acid,  a gel or foam that clears up bumps, swelling, and redness. It also stops bacteria growth on your skin. Brimonidine (Mirvaso), a gel that tightens blood vessels in the skin to get rid of some of your redness Calcineurin inhibitors such as pimecrolimus and tacrolimus Clindamycin (Cleocin, Clindagel, ClindaMax), an antibiotic that kills bacteria on your skin Erythromycin (Erygel), another antibiotic Ivermectin (Soolantra), which reduces inflammation Metronidazole (Flagyl) and doxycycline, also antibiotics Oxymetazoline (Rhofade), a cream Sodium sulfacetamide and sulfur (Avar, Sulfacet, Clenia, Plexion), antibiotics Oral medicines Isotretinoin (Amnesteem, Claravis, and others) is an acne drug sometimes prescribed for rosacea. Don't use it if you're pregnant because it can cause serious birth defects. It can take you a few weeks or months of using one of these medicines for your skin to improve. Rosacea laser treatment Your doctor can also treat rosacea with a laser that uses intense light to get rid of blood vessels that have gotten bigger. Lasers can also ease skin redness, while laser resurfacing can remove thickened skin. Your doctor may also suggest other procedures to treat your rosacea, such as: Dermabrasion , which sands off the top layer of skin Electrocautery, an electric current that zaps damaged blood vessels Rosacea Skin Care There's a lot you can do on your own to improve your symptoms. For starters, try to figure out the things that trigger an outbreak, and then avoid them. To help you do this, keep a journal that tracks your activities and your flare-ups. Also, follow these self-care tips to protect your skin and help fade redness: Put on sunscreen. To avoid symptoms triggered by sunlight, use a sunscreen with broad-spectrum coverage (it blocks UVA and UVB rays) and SPF 30 or higher. Apply it whenever you go outside. Also wear a wide-brimmed hat that covers your face. Use only gentle skin care products. Avoid cleansers and creams that have alcohol, fragrance, witch hazel, and other harsh ingredients. After you wash your face, gently blot your skin dry with a soft cloth. Use a moisturizer. It's especially helpful in cold weather, when low temps and wind can dry up your skin. Oil-free is best. Be careful with cosmetics .  Use high-quality, oil-free makeup. Massage your face. Gently rub your skin in a circular motion. Start in the middle of your face and work your way outward toward your ears. Cover up. If you want to cover your skin, use a green-tinted cover-up on your face to hide redness and broken blood vessels. Go indoors. Get out of the heat and sun and cool off in an air-conditioned room. Care for your eyes. If rosacea has made them red and irritated, use a watered-down baby shampoo or eyelid cleaner to gently clean your eyelids every day. Also put a warm compress on your eyes a few times a day. Eating an anti-inflammatory diet, like a Mediterranean diet, seems to help some people who have rosacea. It's also important to care for your emotions along with your skin problems . If you feel embarrassed by the way you look, or you think it's starting to affect your self-esteem, talk to your doctor or a counselor. You can also join a support group where you can meet people who know just what you're going through. When to See a Doctor If you have any symptoms of rosacea, especially if they cause discomfort, see your doctor.  They may refer you to a dermatologist for treatment. Timely treatment can keep your condition from getting more serious."
37,What Is Roseola?,"Roseola is a common virus that infects children under age 2. Most of the time, it’s nothing to worry about, and kids get better on their own. It's also sometimes called “sixth disease.” What Are the Symptoms? A child may not have any symptoms for 5-15 days after getting the virus that causes roseola. When symptoms do appear, the first thing you’ll notice is a sudden, high fever (over 103 F) that lasts or can come and go for 3-7 days. Other than the fever, your child might seem healthy. They may be restless or irritable. Once the fever goes away, they might also develop a raised, spotty, reddish rash , mainly on their neck and trunk. It doesn’t itch and may last just a few hours or a few days. Your child might also have diarrhea , cough , and droopy or swollen eyelids. What Causes Roseola? It’s an infection brought on by human herpesvirus 6 or, occasionally, human herpesvirus 7. It remains in the child’s body but usually remains latent, or turned off. It’s most common in infants and children between 6 and 24 months old. Diagnosis and Treatment A doctor usually knows your child has roseola because of the telltale symptoms: high fever followed by rash. Usually, no lab tests are needed. Since it’s caused by a virus, antibiotics won’t help cure it. So, your child’s doctor will likely just treat their symptoms to make them more comfortable. For high fever, they might recommend acetaminophen or ibuprofen . If your child develops other symptoms or becomes very sick, they may order blood or urine tests. Roseola is contagious, so your doctor will tell you to keep your child away from others, at least until the fever goes away. Once it’s been gone for at least 24 hours, they can play with other kids, even if they still have a rash. What Problems Can It Cause? Sometimes, a very high fever may cause seizures . If this happens to your child, they might pass out for a short time. Their arms and legs may jerk for many seconds or minutes. They could also lose control of their bladder and bowels. If your child has a seizure, call 911. Luckily, most seizures in young children don’t last long and aren’t harmful."
38,"What Is My Rotator Cuff, and Why Does It Hurt?","What Is a Rotator Cuff? Your rotator cuff is made up of muscles and tendons that keep the ball (head) of your upper arm bone (humerus) in your shoulder socket. It also helps you raise and rotate your arm. It’s a complicated process that your body makes look easy. Rotator cuff muscles Each one of the following muscles is part of the rotator cuff and plays an important role: Supraspinatus. This holds your humerus in place, keeps your upper arm stable, and helps lift your arm. Infraspinatus. This is the main muscle that lets you rotate and extend your shoulder. Teres minor. This is the smallest rotator cuff muscle. Its main job is to help with rotation of your arm away from your body. Subscapularis. This holds your upper arm bone to your shoulder blade and helps you rotate your arm, hold it straight out, and lower it. These muscles are attached to your arm bone with tendons that form a covering (cuff) over the ball of the humerus. Your rotator cuff helps you do things like get something off a high shelf and comb your hair. It’s especially important in sports like baseball, swimming , and tennis. This part of your body is made up of muscles and tendons. They keep your arm and shoulder together and allow you to move your arm. (Photo Credit: Suriya Siritam/Dreamstime) Rotator Cuff Injuries Rotator cuff tear . The tendons in your shoulder can become frayed, partially torn, or completely detached from the bone. It's often the result of wear and tear from daily use over time. You’re more likely to have this if you have a job where you need to move your arm a certain way over and over, like a painter or a carpenter, or you play sports like tennis and baseball. It also can happen suddenly if you fall on your arm or try to lift something heavy. Rotator cuff tendinopathy . Formerly called tendinitis , this is inflammation or irritation of a tendon that attaches to a bone. It causes pain in the area just outside the joint. Common types of tendinopathy include pitcher’s and swimmer’s shoulder. Bursitis . The bursa (a small sac filled with fluid that protects your rotator cuff) can get irritated when you repeat the same motion over and over again, like throwing a baseball or lifting something over your head. Bursitis also can be caused by an infection. Symptoms of Rotator Cuff Injury A rotator cuff tear or other injury may cause: Dull pain in your shoulder Weakness in your arm Trouble sleeping Pain that appears when you touch your head or reach behind your back Rotator cuff pain can limit the range of motion in your arm. You may feel grinding or crackling when you move your shoulder. Sometimes, you can have a rotator cuff injury and feel no pain at all. Diagnosing Shoulder Pain To diagnose your shoulder pain, your doctor will move your arm around, press on or around your shoulder, and test the strength of muscles in your shoulder and arms. You can't see a rotator cuff tear on an X-ray, but your doctor will be able to see other injuries to your shoulder such as arthritis or bone spurs. You may have other tests, including: Ultrasound, which shows soft tissue areas such as tendons and muscles and how your shoulder looks as it's moving. Your technician can scan your other shoulder to see how the two compare. Magnetic resonance imaging (MRI) , which can provide detailed images of the structure of your shoulder. Rotator Cuff Injury Treatment Most rotator cuff injuries get better over time without any kind of aggressive treatment. For tendinitis, bursitis, or a minor tear, your doctor may recommend: Rest, including avoiding repetitive motions or overhead sports (tennis, baseball, volleyball, swimming , and others) A combination of ice and heat Over-the-counter pain relievers like aspirin , ibuprofen , and naproxen Physical therapy, which includes stretching and strengthening exercises to get you more mobile If you still have pain and other symptoms after treating your rotator cuff injury at home, you may need different treatment. Steroid injections A shot of cortisone into the joint may help if your shoulder pain keeps you from sleeping or limits your daily activities. While they can provide quick pain relief, steroid shots can eventually weaken your tendons. Surgery About 80% to 85% of rotator cuff injuries are improved without surgery. Your doctor may recommend it if you're still in pain after trying other treatments. But it will depend on your age, your overall health, and what kinds of activities you do. There's no harm in trying nonsurgical options first. Doctors have found no difference in surgery outcomes if you have it right away or wait. Surgery may be the first choice, though, if you tore a tendon completely during a fall or other accident. There are several types of surgeries for rotator cuff tears, depending on how serious your injury is. You may have the tendon reattached to the bone, or you may need your shoulder completely rebuilt. Preventing Rotator Cuff Injuries Your rotator cuff can tear again after treatment or surgery, so it's important to prevent another injury. Here's what you can do: Protect your joint . Ask your doctor what movements and activities you should avoid to give your shoulder a chance to heal. Be cautious when you raise your arms over your head, and don't hold heavy items out away from your body. Pay attention to your posture, and if you do sports, check with a trainer to be sure you're using good form. Strengthen. Building up the muscles in and around your shoulder will help keep your rotator cuff stable and lessen pain. Focus on the muscles in all parts of your shoulder, in your upper back, and in your arms. Get more flexible. After strengthening, gentle stretching will restore your shoulder's range of motion, reduce achiness, and lengthen your muscles. You'll get the best results from a shoulder conditioning program if you do your exercises two to three times a week. Before you start, talk with your doctor or physical therapist about the best kinds of exercise to do. Rotator Cuff Exercises How to strengthen the rotator cuff Before starting your exercise program, take stock of the range of motion in your shoulder. This will help you rate your progress. Begin your exercises slowly. Stop when you start to feel pain. Warm up for 10 minutes before starting your exercises with a low-impact activity such as cycling on a stationary bike or walking. Practice good posture in your shoulders: While sitting or standing, focus on pulling them down and holding them down. Ice your shoulder for about 20 minutes a day. The following are easy exercises to do at home with little or no equipment. Pendulum. Place one hand on a table or countertop and lean forward. Your other arm should hang loosely at your side. Keep your back straight and bend your knees. Swing your arm gently back and forth, then from side to side, and finally in a circle. Repeat with your other arm for two sets of 10 repetitions. Shoulder stretch . Relax your shoulders and bring one arm across your chest. Bend your other arm and use it to pull the extended arm closer to your chest. Don't pull on your elbow. Hold the position for 30 seconds and relax for 30 seconds more. Do that four times, then repeat on the other side. Sleeper stretch . Lie on your side on a firm surface with the injured shoulder down. Extend your affected arm straight forward and bend your elbow at a 90-degree angle so your hand points toward the ceiling. Using your other hand, grasp your arm above the wrist and press it down toward your hip. Stop when you feel a stretch in the back of your affected shoulder. Hold this position for 30 seconds and relax for 30 seconds more. Repeat four times, three times a day. Elbow flex . Choose a weight that you can lift for three sets of eight repetitions. Stand, holding a weight in each hand with your elbows close to your sides. Slowly bend one arm, bringing the weight toward your shoulder and hold for 2 seconds. Return the weight slowly to your starting position. Repeat with the other arm. Increase the weight a pound at a time as the exercise gets easier, with a 10- to 15-pound maximum weight. Elbow pull . Attach the center of a resistance band to the knob of a closed door or another stable object. Facing the anchor point, take the ends of the band in each hand and hold your elbows bent at your sides. Step back until you feel tension. Steadily push both elbows back and then slowly return your arms to their starting position, squeezing your shoulder blades together as you pull. Do three sets of eight pulls."
39,Do I Need Physical Therapy for a Rotator Cuff Tear?,"If you have a rotator cuff tear , you’re not alone. It happens to millions of people every year. It’s a common cause of shoulder pain . The right treatment can make you feel better, keep a small injury from getting worse, and help you heal. For many people, physical therapy (PT) is the answer. It may be all you need to treat an injured rotator cuff . PT is a way to get back strength and movement after an injury. It includes things like exercise , ice, heat, massage , and equipment to help return your shoulder back to its normal range of motion. Your Rotator Cuff The rotator cuff is a group of tendons and muscles in your shoulder. They form a “cuff” over the top end of your arm. It helps you lift and rotate your arm. And it keeps the shoulder steady as your arm moves. A rotator cuff tear can be caused by different things. It can get sore from normal wear and tear over the years. This happens mostly to people over age 40. But you can also get one in a fall or by repeating the same activity over and over. When you do the same thing again and again, the rotator cuff can start to fray, like a worn sock. It can separate or tear, especially if you lift something heavy. Is PT for Me? If you think you have a tear, see your doctor. They may send you to someone who treats bones, joints, muscles, and tendons, called an orthopedic doctor. They can talk to you about surgical and nonsurgical options, including PT. Unless the injury is severe, PT is a typical starting point. Your physical therapist will ask questions about your life and the things you do. They’ll do some tests to learn more about your pain . The therapist will ask you to raise your arm, move it to the side, or push against something to see what your limits are. PT helps in lots of ways. One study shows that people who got PT for a rotator cuff tear did just as well as those who had surgery. The therapist will help you: Get back your range of motion Learn exercises to strengthen your shoulder muscles Improve the way you sit and stand (your posture) to help reduce pain Find a way to sleep that doesn’t hurt your shoulder Learn to carry objects safely Use ice or heat to ease the pain Understand why you need to keep moving Find ways to do things so that they don’t hurt your shoulder Return to your regular activities (be patient -- this can take a while) PT can also help you recover after rotator cuff surgery . It’s the same idea -- to improve strength and movement and get back to regular life. The therapist will show you how not to injure your shoulder again after surgery. As you recover, pay attention to your pain and ask for help if you need it. That’s the best way to heal your injured shoulder and keep it as strong as possible for the rest of your life."
