,title,body
0,Waldenstrom's Macroglobulinemia,"What Is Waldenstrom's Macroglobulinemia? If your doctor says you have Waldenstrom's macroglobulinemia, it means you have a rare blood cancer that usually spreads slowly. It's also called lymphoplasmacytic lymphoma (LPL). This disease is a kind of non-Hodgkin's lymphoma. These are cancers that start in white blood cells called lymphocytes, which are a part of your immune system -- your body's defense against germs. Some lymphocytes are called ""B cells,"" which help your body fight off infections. They do this by turning into plasma cells that make a protein called immunoglobulin M. This protein attaches to germs and helps your immune system target them. In Waldenstrom's macroglobulinemia, something goes wrong with this process. The B cells turn into cancer cells, which means they grow out of control. These cancer cells form mainly in your bone marrow, the spongy tissue in the center of most bones. They crowd out healthy blood cells. Waldenstrom's macroglobulinemia cells can also cause problems because they make large amounts of immunoglobulin M. When this builds up, your blood can become thicker than usual. It's harder for your blood to move through your blood vessels. There's no cure for Waldenstrom's macroglobulinemia, but there are treatments that can help. Medicines can keep it under control, sometimes for many years. While you manage this disease, it's important to reach out to family and friends to get the backing you need. They can give you support while you get treatment and help you handle the emotional roller coaster that sometimes goes along with a cancer diagnosis. Causes Experts think that changes in your DNA may lead to the disease. Nine out of 10 times, Waldenstrom's macroglobulinemia cells have a change on a gene called MYD88. Researchers have also linked another gene, CXCR4, to the disease. Both genes help cells send signals to each other, so they stay alive. The DNA changes may cause the genes to get stuck in the ""on"" position, so cells live longer than they normally do. Scientists are studying what causes these DNA changes. They know that they aren't passed down from your parents. Most of the time, the changes happen later in life. This may explain why Waldenstrom's macroglobulinemia is usually diagnosed in older people. The disease is more common in men than women. Your chances of having Waldenstrom's macroglobulinemia are higher if you: Are 50 or older Are white Have a condition called MGUS (monoclonal gammopathy of undetermined significance) Have a relative with a disease that affects their white blood cells. Symptoms You may not notice anything different. One in four people with Waldenstrom's macroglobulinemia don't have any symptoms when they're diagnosed. It's possible, though, that you may have a variety of health issues. As the cancer cells spread in your bone marrow, your healthy blood cell levels drop. Having fewer red blood cells causes a condition called anemia, which can leave you feeling tired. And if you have fewer white cells, it’s harder for your body to fight off infections. Your number of platelets -- blood cells that help you form clots -- may also drop. This can cause you to bleed or bruise more easily. And Waldenstrom's macroglobulinemia cells in your organs can trigger swelling. Besides these problems, you may also get symptoms like: Headaches Night sweats Lack of appetite and weight loss without trying Frequent infections Fevers Swollen belly or lymph nodes Confusion, dizziness, and clumsiness Shortness of breath Changes in vision, such as blurriness Numbness or tingling in your hands or feet Getting a Diagnosis Your doctor will start by asking questions about your health history and do a physical exam. They may check for swelling in your lymph nodes, liver, and spleen. Your doctor may also ask you to take tests, such as: Blood tests. Your doctor takes a sample of your blood and sends it to a lab, where technicians look at it under a microscope. Blood tests show if you have low levels of healthy blood cells. They can also check the amount of immunoglobulin M proteins in your blood. Blood tests also measure how well your organs are working. Bone marrow aspiration and biopsy. To confirm that you have Waldenstrom's macroglobulinemia, your doctor tests your bone marrow for cancer cells. Bone marrow aspiration and biopsy are done at your doctor's office or in a hospital. In an aspiration, your doctor numbs part of your hip and puts in a thin needle. It sucks out a small sample of liquid bone marrow. Your doctor usually then does a biopsy. Another needle removes some of your bone marrow tissue. Your doctor sends the samples to a lab, where technicians check for cancer cells. They also test your bone marrow for markers of Waldenstrom's macroglobulinemia. Imaging tests. Your doctor may want to see if the cancer has spread. These tests include X-rays and a CT scan, which is a powerful kind of X-ray. They're often combined with PET scans, which use a weak radioactive material to look for cancer cells. Questions for Your Doctor Where is my Waldenstrom’s macroglobulinemia located? Will I need any other tests to help guide my treatment? What are my treatment options and their goals? Which ones do you recommend? What are the risks and side effects for each treatment? How can I tell if my treatments are working? What kind of follow-up will I need? After treatment, are there any symptoms that I should watch out for? Treatment Your doctor will suggest a treatment plan based on your symptoms and how much the cancer has spread. If you don't have symptoms, your doctor may suggest a ""watch-and-wait"" approach. This means you won't get treatment, but they'll keep a close eye on your health. You may need to get blood tests every few months. It can be years before you need treatment. If you do have symptoms, your doctor may suggest one treatment or a combination of treatments: Chemotherapy. These drugs use powerful chemicals to kill cancer cells. You take them by mouth, or a doctor injects them into you. Biological therapy. You'll get medicines that help your immune system fight cancer cells. You might also use man-made versions of substances that your immune system makes. A doctor usually injects them into your body. Targeted therapy. These are drugs that block certain proteins or enzymes that help the cancer cells grow. The medicine often comes in pill form. Plasma exchange. Your doctor may want you to lower your levels of immunoglobulin M. To do this, you may need a plasma exchange. In this treatment, you're hooked up to an IV. Your blood is filtered through a machine that separates the liquid part of your blood, called plasma, from the blood cells, to remove immunoglobulin M. Healthy plasma gets swapped in. Stem cell transplant. In this treatment, high doses of chemotherapy kill the cancerous bone marrow. A bone marrow transplant replaces it with stem cells. These stem cells grow into new, healthy bone marrow. This procedure is not common for Waldenstrom's macroglobulinemia. Clinical trials. In these research studies, you try out experimental treatments that have not yet been approved by the FDA. Your doctor can help you find out if one's right for you. What to Expect Because Waldenstrom's macroglobulinemia usually spreads slowly, you can keep it in check if you catch it early. During treatment, you may have side effects. For example, chemotherapy can lead to nausea, temporary hair loss, diarrhea, and fatigue. Ask your doctor for advice on how to manage these problems. They may be able to suggest medicines that can help. After treatment, you'll need to go to follow-up appointments. Your doctor will check that you're healthy and that the cancer hasn't returned. Getting Support Consider joining a support group, where you can talk to others who understand just what you're going through. The groups meet in person, on the telephone, or online. To find a local support group, ask your doctor, social worker, or other people with your condition. You can also go to the websites of the Leukemia & Lymphoma Society, International Waldenstrom's Macroglobulinemia Foundation, National Cancer Institute, and American Cancer Society."
1,What Is Geographic Tongue?,"What Is Geographic Tongue? Geographic tongue is a condition that causes red patches to form on your tongue or in other areas of your mouth. It gets its name because the patches look like a map. Doctors sometimes call it benign migratory glossitis . The patches can come and go and change shape. Their duration can range from a few days to several years. Geographic tongue affects about 1%-3% of people. It's benign, which means it’s harmless. It isn't linked to an infection or cancer . It isn’t contagious, so you can’t catch it from or pass it to someone else. It often doesn't have symptoms and usually goes away on its own. Geographic Tongue Symptoms The main symptom of geographic tongue is the presence of uneven red patches on the top, sides, and underside of your tongue. It's rare, but they might also be on your gums, inside your cheeks, or on the roof of your mouth. These patches may: Have a white or light-colored border Change in size, shape, and color Start in one area and then move to another Be smooth, unlike the small bumps (papillae) that usually cover your tongue You may not know that you have geographic tongue until your dentist or doctor spots it during a mouth exam. It's not common, but some people with geographic tongue might have a burning or painful feeling. This is often because of things such as: Hot, spicy, or acidic foods Cigarette smoke Toothpaste You might also have swollen lymph nodes under your jaw. Geographic Tongue Causes Doctors aren't sure what causes geographic tongue. It might be linked with certain health issues, such as: Eczema and psoriasis Some types of arthritis Type 1 diabetes Geographic tongue tends to run in families, so it might also have something to do with your genes. Also, not having enough of these nutrients might cause geographic tongue: Iron Zinc Folic acid Vitamins B6 and B12 Other things that might cause it are stress, hormone changes, and allergies. Geographic tongue is also linked to a condition called fissured tongue, which causes grooves to form on the tongue. Doctors don't know what causes a fissured tongue, but it's more common in older adults. Geographic Tongue Risk Factors Geographic tongue can happen at any age, but it’s more likely in young adults. It’s also more common in women than in men. Other things that raise your risk of geographic tongue: Eczema Psoriasis Type 1 diabetes Certain types of arthritis A family history of geographic tongue Not having enough iron, zinc, folic acid, and vitamins B6 and B12 Having a fissured tongue Taking hormonal birth control A lot of stress Allergies Geographic Tongue Diagnosis Your dentist or doctor will ask about your symptoms and look at your mouth and tongue. During the exam, your doctor might: Ask you to move your tongue in different directions Touch your tongue to feel changes in the texture Check for any tenderness See if there are any signs of infection, such as swollen lymph nodes in your neck You may need tests to rule out other medical conditions. Geographic Tongue Treatment Any pain or discomfort will probably get better on its own. But if you have severe, constant pain, medication can help. Your doctor or dentist may prescribe: Over-the-counter pain relievers Anti-inflammatories Mouth rinses with anesthetic Corticosteroids that you put on your tongue Zinc supplements It also helps to limit or avoid things such as: Tobacco Hot, spicy, or acidic foods or dry, salty nuts Toothpaste with additives (such as sodium lauryl sulfate), whitening agents, or heavy flavoring (toothpaste for sensitive teeth is a better choice)"
2,Skin Conditions and Warts,"Warts are skin growths that are caused by the human papillomavirus ( HPV ). There are more than 100 kinds of HPV, some of which can cause warts on the skin. HPV stimulates quick growth of cells on the skin's outer layer. In most cases, common warts appear on the fingers, near the fingernails , or on the hands. Certain types of HPV can cause warts to appear in the genital area. Warts are caused through direct contact with HPV, which is contagious. HPV may spread by person-to-person contact or through direct contact with an object used by a person with the virus. The virus that causes warts also can spread to other places on the body of the person with warts. Three out of 4 people will develop a wart (verruca vulgaris) at some time in their lives. Warts are caused by the HPV virus, which is contagious. Photo credit: iStock/Getty Images Types of Warts Plantar warts : This type of wart usually appears as a flesh-colored or light brown lump flecked with small clotted blood vessels that look like tiny black dots. Plantar warts affect the soles of the feet. Flat warts (verruca plana) are small pink or brown bumps that appear on the face or legs. They're caused by the human papilloma virus (HPV). Photo Credit: Dr. Harout Tanielian / Science Source Genital warts: Genital warts can appear in the pubic area, on the genitals, in or around the anus , and/or in the vagina . They look like small flesh-colored, pink, or red growths. The warts may look similar to the small parts of a cauliflower, or they may be very tiny and difficult to see. They often appear in clusters of three or four, and may grow and spread rapidly. They usually aren't painful, although they may cause mild pain, bleeding, and itching . HPV infection is the most common sexually transmitted disease in North America. Certain forms of the virus can cause cervical cancer . Flat warts: This type of wart is more common in teens and children than in adults. Flat warts are smoother, flatter, and smaller than other warts, and they generally occur in groups on your face. Flat warts also can appear on the legs, especially among girls and women. How Are Warts Treated? In most cases, warts on the skin are harmless and may go away without treatment. That includes flat warts, though they may take a few months or even years to go away. However, genital warts should be evaluated by a doctor. Warts sometimes come back after treatment, and you may need more than one type of treatment. Although doctors try to clear warts quickly, most methods to remove them require multiple treatments. Treatments include: Freezing (cryotherapy): This can be done with over-the-counter freezing spray products or by your doctor, who will use liquid nitrogen to freeze the wart. With the at-home treatment, temperatures can reach as low as a negative 100 degrees. The downside of home treatment is that it may not freeze the wart deeply enough to be effective. It can also be painful, since the spray needs to be applied longer than a freezing treatment you'd get in a doctor’s office. When it works, a blister forms around the wart and the dead tissue falls off within 1-2 weeks. Cantharidin: This substance is made with an extract of a blister beetle. It's applied to the skin and forms a blister around the wart. Then the area is covered with a bandage. The blister lifts the wart off the skin. This photo shows common warts (verruca vulgaris) on the toes of a teenage boy after treatment with salicylic acid. Other medications : These include bleomycin , which is injected into a wart to kill the virus that causes it, and imiquimod ( Aldara, Zyclara ), an immunotherapy drug that stimulates your immune system to fight off the wart virus. It comes as a prescription cream. Although imiquimod is approved for genital warts, it can also work fairly well on other types of warts. Salicylic acid : Over-the-counter wart treatments come in several forms (gel, ointments, or pads) and have salicylic acid as their active ingredient. When you apply the treatment on a regular basis, the acid gradually dissolves the wart tissue. The process may take several weeks. This is not for use on genital warts. Minor surgery: When warts can't be removed by other therapies, a doctor can do surgery to cut away the wart. They'll destroy the base of the wart  using an electric needle or by cryosurgery (deep freezing). Laser surgery: This procedure uses an intense beam of light (a laser) to burn and destroy wart tissue. Can Warts Be Prevented? If you already have warts, you can prevent them from spreading by not picking at them. Consider covering warts with bandages. In addition, keep your hands as dry as possible. Warts are harder to control in moist environments. Never brush, comb, or shave areas where you have warts, since this can cause the virus to spread. Wash your hands thoroughly after touching any warts. To prevent genital warts, some of the steps you can take include: Not having sexual contact Using condoms during sexual activity Having sex only with a partner who isn't having sex with other people Avoiding sex with anyone with visible symptoms of genital warts Getting the HPV vaccine"
3,How Do I Know if I Have Genital Warts?,"Both men and women can get genital warts , but the symptoms might be different. Here is what you need to know. Women In women, genital warts appear in and around the vagina , vulva, or anus , or on the cervix . They might be very small or appear as large clusters. They may be reddish in color or white. Sometimes, you can have genital warts but show no symptoms at all. If you’re a woman who’s had unprotected sex, you’ll want to have your doctor examine you. Testing for low-risk HPV -- the virus that causes genital warts -- isn’t routinely done. Your doctor will have to examine you to see if you have warts to know for sure. Warts may appear months or years after sexual contact. Sometimes, genital warts can form inside your vagina and be hard to spot. You could also have symptoms that look like genital warts but turn out to be something else. Men In men, the warts may appear on the penis , scrotum, or around the anus. For men, there’s no reliable test that can find the virus responsible for genital warts. You’ll need to ask your doctor for an exam or get regular exams. In both men and women, genital warts can also show up on the lips, mouth , tongue , and throat. See your doctor right away if you or your partner develops bumps or warts in the genital area or if: You have an abnormal discharge from your vagina or penis You have burning, pain , or bleeding when urinating or during sex Your partner is diagnosed with genital warts or is having some of the symptoms Your child has genital warts What Happens During the Exam? Your doctor will ask a number of questions, such as: Do you practice safe sex ? Do you have multiple partners? Have you or your partner been tested for sexually transmitted infections (STIs)? Are you having any symptoms? Are you pregnant or planning to get pregnant ? Your doctor will examine you or take a biopsy (a sample of the wart) to see if you have genital warts. They might draw a blood sample to test for HIV and syphilis . Depending on the results, they may also refer you to a specialist for further testing."
