,title,body
19,Health Insurance: 5 Tips for Emergency Room Visits,"If you're at the emergency room (ER), you are probably there because you're dealing with a serious medical problem. While you are there, you will have to answer questions about your medical history and your health insurance. You might have to make important decisions about tests and procedures, too. Being prepared may help you avoid huge medical bills. Here are five tips to get better and more affordable care during a medical emergency. 1. Don't Assume the ER Is the Right Place for You You might avoid a long wait and save a lot of money by going to an urgent care center instead of the ER. These centers can handle many illnesses and injuries that used to be treated only at an ER, such as: Burns Minor broken bones Cuts that require stitches Save the ER for life-threatening conditions like seizures , serious head injuries , and severe pain, such as pain that could point to a heart attack or stroke, or concerning abdominal issues (ex: appendicitis). A few tips:  Many urgent care centers take insurance coverage. Ask if your plan is accepted. If you are taking your child to an ER or urgent care clinic, try to use a pediatric center or one where there are pediatricians on staff. 2. Be Ready to Answer Questions About Your Health Whether at an urgent care center or the ER, the doctor treating you will need good information to give you the best care. If possible, be ready to provide your medical history when you arrive at the ER, including: A list of all daily/regular or new medications or antibiotics or supplements you're taking, have been recently prescribed, or recently completed Any allergies you have, especially to medications A list of previous stays at the hospital (especially ICU admissions)and diagnoses you have received Information on any past surgeries A list of past or chronic illnesses Health problems that run in your family Vaccines you've received Any specialists (including their names) you may be seeing It's a good idea to store all this information on your cell phone using a medical records app. Or if you prefer, write down your medical information and keep it in a place where you can grab it quickly. That way, you won't have to try to remember all of it when you're sick or hurt. 3. Know Your ER Rights The Affordable Care Act requires insurance companies to cover care you receive in the ER if you have an emergency medical condition. You don't need to get approval ahead of time, and it doesn't matter whether the hospital or facility is in or outside of your insurance network. But the key words are ""emergency medical condition."" That means your symptoms are bad enough for you to think your health will be in danger if you don't get care right away. If you have time, try to check with your usual doctor first. 4. Could My Doctor Do This Test Later? You may need a lot of tests or imaging while you are in the ER to figure out what's causing your health problem. This is especially true when you have a medical emergency. But tests and imaging done in a hospital can cost a lot more than they would if done elsewhere. If you are able, ask your ER doctor if there's any risk in putting off tests and scans until you can see your primary care doctor, who might decide you don't need them. If you do need the tests but it's not an emergency, they'll likely cost less in a doctor's office than they will at the ER. 5. Check ER Bills Carefully You should be charged in-network rates for most of the care you get at the ER. During your stay, though, you might be treated by someone outside your network. This could be the ER doctor, a technician, or a specialist. Those providers can bill you directly for the difference between what they charge and what your health plan pays. Most plans will cover all ER fees when you're treated for a true emergency. But you may have to submit them yourself to your insurance company. Check all your ER bills and insurance reports carefully."
20,How to Save Money on Prescription Drugs,"About half of Americans take at least one prescription drug. If you're one of them, you've probably noticed that prescription medications can be quite expensive, and costs are rising. You've got resources to help you save money while still putting your health first. For starters, your doctor and pharmacist can be extremely helpful -- if you ask. But if you don't speak up, they'll never know. Go Generic These medications have the same active ingredients as brand-name drugs, but often at a much lower cost. ""It's the first place to start,"" says Reid Rasmussen, a consumer health expert with 25 years of health care insurance and administration experience. ""It's possible that the non-generic works better for you, but by all means start with the generic, always."" The process is easy: If your medication is available as a generic, the pharmacist will automatically give you that version. ""In general, generics are cheaper, but there are some exceptions to the rule,"" says John Meigs, MD, spokesman for the American Academy of Family Physicians. If a generic is too expensive, it's worth asking your doctor about other treatment options. Get the Most Out of Your Insurance You pay for health insurance, so take advantage of it. Each insurance company has a list of drugs that they do and don't cover, called a formulary. But don't bother trying to make sense of it, Rassmussen says. It's much easier to simply call your insurance company and ask about the drugs you take. And if you get to the pharmacy and find out a drug is too expensive or isn't covered, he recommends you pick up the phone. Say something like, ""I went to fill this and my pharmacist said it's not covered. Is there an alternative?"" There might be a similar medication that your plan will pay for. You could try getting a higher dose and splitting it in half, suggests Mohamed Jalloh, PharmD, a spokesman for the American Pharmacists Association. ""Some insurance companies charge based upon the quantity of medications,"" he says, ""so by doubling the strength of a medication and cutting it in half, you may only be charged for 15 whole tablets instead of 30 whole tablets."" (Run the idea past your doctor or pharmacist first, since some pills shouldn't be split.) Ask for Help ""A lot of times, we [doctors] don't know how much medicines cost,"" Meigs says. ""Let your doctor know if you're having trouble paying for medications. He or she can look at alternative medications that might be less expensive."" Check with your pharmacist about special programs or discount cards . ""Some pharmacies offer plans where people can get 30-day prescriptions of certain medications for as low as $4. In some cases, patients may even get them for free,"" Jalloh says. Pharmacists will also know if drug companies are running promotions. They might also be able to give you coupons for certain drugs or manufacturers. These are things that your doctor wouldn't have known, but your pharmacist will. You might be able to save $50 or so, Rasmussen says. Comparison Shopping The price of a medication can vary widely from one pharmacy to another, too. Technology can make it easier to shop around. ""Apps like GoodRx help to clarify the prices of medications at various pharmacies. This allows you to identify which pharmacy would give you the best deal for all of your medications,"" Jalloh says. When you shop online and get your prescription by mail, make sure you're buying from a legitimate and licensed source. Look for one that: Has a Verified Internet Pharmacy Practice Site (VIPPS) seal from the National Association of Boards of Pharmacy or a "".pharmacy"" address Is registered with the Canadian International Pharmacy Association, www.cipa.com Has high ratings and good reviews at pharmacychecker.com The price at a pharmacy outside of the U.S. may seem like a huge discount, but a great deal isn't one if you aren't really getting the drug you need. At some websites, you can pay a monthly fee in exchange for discounts. But ""for the most part, these companies are charging you $29 per month to get you free programs,"" Rasmussen says. Talk to your pharmacist about prescription savings programs instead. Patient Assistance Programs Most drug companies offer patient assistance programs. These help you get free or reduced-cost medications. You'll have to qualify for the program, and each manufacturer has different standards. Send a note to the company through their website. Or ask your pharmacist for help reaching out to the right place. Don't Skip Doses This may seem like an obvious no-no, but it's more common than you might think. More than 12% of U.S. adults have skipped taking medication or simply not filled a prescription to save money, according to a government survey. ""A lot of times if the patient can't afford [a medication], they don't take it,"" Meigs says. ""Or they may only take it half of the time. That obviously complicates their care."" It makes the drug less effective, which is a waste of money and can lead to serious health problems -- and even bigger bills -- later."
21,What Is Babesiosis?,"Babesiosis is a rare and life-threatening infection of the red blood cells that's usually spread by ticks . It's caused by tiny parasites called Babesia. The kind that most often affects humans is called Babesia microti . They enter your bloodstream when you're bitten by an infected deer tick. Other ways babesiosis can spread include: Contaminated blood transfusions A pregnant , infected mother passing it to their baby in the womb or during birth Babesiosis usually happens in the warmer months. Ticks carrying the parasite have been found in: Block Island, R.I. Fire Island, Shelter Island, and eastern Long Island, N.Y. Martha's Vineyard, Mass. Nantucket, Mass. Coastal areas of New Jersey People have gotten this infection in other states, too, including: California Connecticut Delaware Maine Minnesota Wisconsin It's also been seen in Europe. Symptoms Signs of babesiosis start 1 to 8 weeks after you come in contact with the parasite that causes the disease. Sometimes you won't notice any symptoms. If you do, they might include: Body aches Chills Fatigue Fever Headache Loss of appetite Sweating You also can get a condition called hemolytic anemia in which your red blood cells die faster than your body can make new ones. Symptoms of this can include: Confusion Dark-colored urine Dizziness Heart murmur Rapid heart rate Swelling of your spleen and liver Very pale skin Weakness Yellow skin, eyes , and mouth ( jaundice ) Symptoms can be worse if you're elderly, no longer have your spleen, or have a health condition or take medications that weaken your immune system . If you notice any of these symptoms, see your doctor and be sure to tell them if you've traveled recently. Ticks can be the size of a poppy seed, so you may not know if you've been bitten by one. Diagnosis Your doctor will order blood tests to check for signs of infection. This includes looking for Babesia in the blood under a microscope. They may also want to do other blood tests to rule out conditions with similar symptoms, such as anaplasmosis or Lyme disease , which is also caused by ticks. It's possible to have Lyme disease at the same time as babesiosis. Treatment and Prevention If you don't have any symptoms, you probably won't need treatment. If you do, your doctor may prescribe a drug called atovaquone that kills microorganisms along with the antibiotic azithromycin .  Another combination they may recommend is quinine with the antibiotic clindamycin. The ticks that cause babesiosis typically have to stay on your body for 36 to 48 hours to cause an infection. Here are some ways to prevent one: Stay away from overgrown grasses and leaf piles, where ticks are likely to be. Wear long pants tucked into your socks and a long-sleeve shirt when you're near where ticks thrive. Wear light-colored clothes so you can easily spot ticks. Use bug repellant that has DEET in it on your skin and clothing. Before going indoors, check your clothing and pets for ticks. Once inside, check your entire body for ticks using a full-length or hand-held mirror. Remove any ticks with pointed tweezers."
22,What Is Reflex Sympathetic Dystrophy Syndrome?,"Reflex sympathetic dystrophy syndrome (RSD) is a disorder that causes lasting pain , usually in an arm or leg, and it shows up after an injury, stroke , or even heart attack . But the severity of pain is typically worse than the original injury itself. Doctors don’t know exactly what causes it, but they are able to treat many cases. The term reflex sympathetic dystrophy syndrome is actually not a name that doctors use anymore. It’s an older term used to describe one form of Complex Regional Pain Syndrome (CRPS). RSD is sometimes called Type I CRPS, and it’s caused by injury to tissue with no related nerve damage . What Causes RSD? Doctors think the pain caused by RSD comes from problems in your sympathetic nervous system. Your sympathetic nervous system controls blood flow movements that help regulate your heart rate and blood pressure . When you get hurt, your sympathetic nervous system tells your blood vessels to get smaller so you don’t lose too much blood at your injury site. Later, it tells them to open back up so blood can get to damaged tissue and repair it. When you have RSD, your sympathetic nervous system gets mixed signals. It turns on after an injury, but doesn’t turn back off. This causes a lot of pain and swelling at your injury site. Sometimes, you can get RSD even if you haven’t had an injury, although it’s not as common. RSD is a little more typical in women than in men. Children can get it, too, but usually it shows up between ages 30 and 60. Symptoms When you get RSD, your symptoms may show up slowly. You may have pain first, and then it may get worse over time. You may not realize your pain is abnormal at first. The types of injuries that can cause RSD include: Amputation Bruises Burns Cuts Fractures Minor surgery Needle sticks Radiation therapy Sprains It’s most common to get RSD in your arm, shoulder , leg, or hip. Usually the pain spreads beyond your injury site. In some cases, symptoms can spread to other parts of your body, too. RSD can also affect your immune system . This can cause: Redness Skin that’s warm to the touch around the injury Swelling The pain you get with RSD is usually constant and severe. Many people describe RSD pain as: Aching Burning Cold Deep Throbbing Your skin may also feel sensitive when you do things that don’t normally hurt it, like taking a shower. Or it might hurt just to wear your clothes. Other symptoms of RSD include: Changes in your hair or nail growth, or skin’s texture Excess sweat in certain areas of your body Muscle weakness or spasms Stiff joints Trouble moving the injured area White, mottled, red, or blue skin Diagnosis Often, doctors don’t know your pain is being caused by RSD until you’ve had it for some time. When pain doesn’t go away, or is more severe than it should be for your type of injury, it can be the first clue that it could be RSD. There’s no single test that can tell your doctor whether you have RSD. Instead, they’ll rely on a physical exam and your medical history information. There are also a few tests that can provide clues to see if you have certain signs of the condition. These include: Bone scan. This test can detect if any of your bones are wearing away at the ends or whether there are issues with regular blood flow. MRI . Your doctor might order an MRI to look inside your body, specifically at your tissues, for noticeable changes. Sweat test. This test can tell your doctor if you sweat more on one side of your body than the other. Thermography test. This sympathetic nervous system test checks to see if the temperature or blood flow is different at your injury site than in other parts of your body. X-rays. These are typically ordered if your syndrome is in later stages to look for mineral loss in your bones. Treatment Early detection is key in RSD treatment. The earlier you’re able to catch it, the better your treatment will work. Some cases of RSD don’t respond to treatment. RSD doesn’t have a cure, but it’s possible to recover from many of the symptoms. Some of the medications your doctor may suggest include: Anesthetic creams like lidocaine Antidepressants Anti-inflammatory drugs, called NSAIDs Anti- seizure medications that may help treat pain Nasal spray that treats bone loss Nerve blocking injections Over-the-counter options like aspirin , ibuprofen , or naproxen for pain Other treatments that are less frequently used because of their risk of side effects and the lack of evidence that they work as well include: Corticosteroids like methylprednisolone ( Medrol ) or prednisolone (AsmalPred Plus ) to treat swelling Opioids , such as fentanyl ( Duragesic ), hydrocodone ( Hysingla ER , Zohydro ER ), morphine ( Arymo ER , Kadian , Morphabond , MS Contin ), and oxycodone Other ways to treat symptoms include: Electrodes on your spinal cord that send small electric shocks to relieve pain Physical therapy to help you move around more easily and take away pain Psychotherapy that can teach you relaxation methods Splints to help with hand pain If your pain doesn’t seem to be going away, even after treatment, your doctor may suggest a surgery called a sympathectomy. During this procedure, a surgeon removes certain nerves around your blood vessels to help improve your blood flow."
23,Rare Types of Anemia,"Think of your red blood cells as the transport system that carries oxygen to your body’s tissues. When you have anemia , your body doesn’t make enough red blood cells , or these cells don’t work as well as they should. You end up feeling weak, tired , and short of breath. Anemia comes in many forms. Iron-deficiency anemia is most common. Other types of the disease affect only small numbers of people. Here’s a look at some of the rare types of anemia and how they’re treated. Aplastic (or Hypoplastic) Anemia Blood cells are made from stem cells in your bone marrow. When you have aplastic anemia , stem cells in your bone marrow are damaged and can’t make enough new blood cells. You’re either born with aplastic anemia, meaning you inherited a gene from your parents that caused it, or you develop it (acquired). Acquired aplastic anemia is the more common of the two, and sometimes it’s only temporary. Acquired causes include: Autoimmune diseases such as lupus and rheumatoid arthritis Chemicals such as pesticides, arsenic, and benzene Infections including hepatitis , Epstein-Barr virus, and HIV Radiation and chemotherapy treatments for cancer Inherited conditions such as Fanconi anemia, Shwachman-Diamond syndrome, and Diamond-Blackfan anemia, can damage cells and also cause aplastic anemia. Symptoms of aplastic anemia can include everything from shortness of breath and dizziness to headaches , pale skin , chest pain , fast heart rate ( tachycardia ), and cold hands and feet . One way to treat aplastic anemia is with a blood transfusion . You’ll get a donor’s blood through a vein. A stem cell transplant can also treat aplastic anemia. It replaces the damaged stem cells in your bone marrow with healthy cells. Sideroblastic Anemia In this group of blood disorders , your body can't use iron to make hemoglobin -- the protein that carries oxygen in your blood. The iron buildup causes the formation of abnormal red blood cells called sideroblasts. There are two main types of sideroblastic anemia: Acquired sideroblastic anemia can be caused by exposure to certain chemicals or drugs . Hereditary sideroblastic anemia happens when a gene mutation disrupts normal hemoglobin production. This gene produces “heme,” the part of hemoglobin that carries oxygen. Symptoms for both types include: Chest pain Fast heartbeat, or tachycardia Headaches Trouble breathing Weakness and fatigue Treatment for sideroblastic anemia depends on the cause. If you have acquired anemia, you'll need to avoid the chemical or drug that caused it. Other treatments include vitamin B6 therapy and bone marrow or stem cell transplants. Myelodysplastic Syndromes Myelodysplastic syndromes (MDS) are diseases that are caused when your bone marrow is damaged and can't make enough healthy blood cells. MDS is a type of cancer . Some people are born with a gene that causes MDS. These genes are usually passed down from one or both parents. If you have certain inherited syndromes, including Fanconi anemia, Shwachman-Diamond syndrome, Diamond Blackfan anemia, familial platelet disorder, and severe congenital neutropenia , you could be more likely to develop MDS. A small number of people also get MDS after radiation or chemotherapy treatment for cancer . Another risk is exposure to chemicals like benzene, which is found in tobacco smoke. Some people don’t have symptoms with MDS, but others do, including: Bruising or bleeding Infection Fever Shortness of breath Weakness and fatigue Weight loss Oncologists (cancer doctors) and hematologists (blood doctors) treat MDS with chemotherapy, hematopoietic growth factors, and stem cell or bone marrow transplants . Autoimmune Hemolytic Anemia Autoimmune hemolytic anemia happens when your body's immune system attacks and destroys red blood cells faster than it can make new ones. If you have an autoimmune disease like lupus , you’re also more likely to get this type of anemia. Medicines such as methyldopa ( Aldomet ), penicillin , and quinine ( Qualaquin ) can also cause autoimmune hemolytic anemia. Symptoms include fatigue, pale skin, fast heartbeat (tachycardia), trouble breathing, chills, backache, and yellow skin ( jaundice ). Treating the disease that caused the anemia can also stop your red blood cell damage. If you have an autoimmune disease, your doctor might treat you with steroid drugs to calm your immune system , which can help the anemia. Congenital Dyserythropoietic Anemia (CDA) CDA is a group of inherited anemias that reduce the number of healthy red blood cells in the body. All CDAs are passed down through families. There are three types of CDA, types 1, 2, and 3. Type 2 is the most common and type 3 is the rarest. Symptoms include chronic anemia, fatigue, yellow skin and eyes (jaundice), pale skin, and missing fingers and toes at birth. Some people never need treatment. But depending on the severity of the disease, your doctor might recommend a blood transfusion, a stem cell transplant, or medicines to lower iron levels or interferon alfa-2A, a drug typically used for treating leukemia and melanoma . Diamond-Blackfan Anemia If you have Diamond-Blackfan anemia, your bone marrow doesn't make enough red blood cells. Doctors think it is caused by changes to your genes. Symptoms of Diamond-Blackfan anemia include: Fast heartbeat (tachycardia) Fatigue Heart murmur Irritability Pale skin Short height Sleepiness Weak bones Treatments include everything from steroids that can help produce more red blood cells to red blood cell transfusions and bone marrow transplants. Megaloblastic Anemia With this type of anemia, your bone marrow produces abnormally structured red blood cells that are too large and too young. Because they’re not mature or healthy, they can't carry oxygen throughout your body very well. Megaloblastic anemia is caused by too little vitamin B12 (cobalamin) or vitamin B9 (folate). Your body needs these vitamins to make red blood cells. Some people with megaloblastic anemia might not have symptoms for many years. But once symptoms do appear, they’re similar to other types of anemia, and include: Dizziness and fatigue Diarrhea , nausea Fast or irregular heartbeat (tachycardia) Muscle pain or weakness Pale skin Trouble breathing Doctors treat megaloblastic anemia with vitamin B9 and vitamin B12 supplements to replace what your body is missing. You'll also need treatment for any disease -- such as Crohn's -- that caused your body to lack these vitamins. Fanconi Anemia Fanconi anemia makes your blood marrow produce too few blood cells. It's hereditary, meaning it’s passed down from one of your parents through a gene mutation. Symptoms and physical traits of Fanconi anemia include: Abnormal thumbs Easy bruising and bleeding Fatigue Frequent infections Heart , kidney , and bone problems Skin color changes Small body, head, and eyes If you have Fanconi anemia, you’re more likely to get a type of cancer called acute myeloid leukemia , or AML. Your odds of getting cancers of the head, neck, skin, GI tract, or genitals also go up. Treatment depends on several factors, including what stage it’s in and the severity of physical complications. Treatments include hormone therapy and growth factors to boost blood cell growth. If symptoms become severe, your doctor might recommend a bone marrow stem cell transplant. Oftentimes a bone marrow transplant can cure the problems altogether."
