,title,body
0,What Are Lysosomal Storage Disorders?,"['Lysosomal storage disorders are a group of more than 50 rare diseases. They affect the lysosome -- a structure in your cells that breaks down substances such as proteins, carbohydrates, and old cell parts so the body can recycle them. People with these disorders are missing important enzymes (proteins that speed up reactions in the body). Without those enzymes, the lysosome isn’t able to break down these substances. When that happens, they build up in cells and become toxic. They can damage cells and organs in the body. This article covers some of the most common lysosomal storage disorders.', 'Types of Lysosomal Storage Disorders Each disorder affects a different enzyme and has its own set of symptoms. They include: Fabry disease : It affects your ability to make alpha-galactosidase A . This enzyme breaks down a fatty substance called globotriaosylceramide. Without the enzyme, this fat builds up in cells and damages them. Symptoms might include: Pain, numbness, tingling, or burning in the hands and feet Body aches Fever Tiredness Red or purple skin sores Trouble sweating Swelling in the lower legs, ankles , and feet Clouding of the cornea (the clear cover on the front of the eye ) Diarrhea , constipation , or both Trouble breathing Ringing in the ears and hearing loss Dizziness Abnormal heart rhythms, heart attack , and stroke', 'Gaucher disease : A lack of glucocerebrosidase (GBA) causes this condition. This enzyme breaks down a fat called glucocerebroside. Without GBA, the fat builds up in the spleen , liver , and bone marrow. Gaucher disease comes in three types, each with different symptoms. In general, symptoms include: Anemia (low red blood cell count) Enlarged spleen and liver Easy bleeding and bruising Tiredness Bone pain and fractures Joint pain Eye problems Seizures Krabbe disease: This affects the nervous system . A lack of the enzyme galactosylceramidase causes this condition. This enzyme helps make and maintain myelin , the protective coating around nerve cells that helps nerves talk to each other. Symptoms start in the first few months of life and include: Muscle weakness Stiff limbs Trouble walking Vision and hearing loss Muscle spasms Seizures Metachromatic leukodystrophy ( MLD ): You can get MLD if you don’t have the enzyme arylsulfatase A . It normally breaks down a group of fats called sulfatides. Without the enzyme, these fats build up in white matter -- the part of the brain that contains nerve fibers. They destroy the myelin coating that surrounds and protects nerve cells.', ""MLD comes in different forms. Symptoms can include: Loss of feeling in the hands and feet Seizures Trouble walking and talking Vision and hearing loss Mucopolysaccharidosis ( MPS ): This is a group of diseases that affects enzymes that break down certain carbohydrates. The unbroken carbohydrates build up in many different organs. Symptoms of MPS affect many parts of the body and can include: Short height Stiff joints Trouble speaking and hearing Ongoing runny nose Learning problems Heart issues Joint problems Trouble breathing Depression Niemann-Pick disease: This is a group of disorders. The most common forms are types A, B, and C. In types A and B, people lack an enzyme called acid sphingomyelinase (ASM) . It breaks down a fatty substance called sphingomyelin, which is found in every cell. In type C, the body can't break down cholesterol and fats in cells. Cholesterol builds up in the liver and spleen. Other fats build up in the brain . Symptoms of Niemann-Pick include: An enlarged liver and spleen Trouble moving your eyes up and down Jaundice (yellow skin and eyes ) Slow development Breathing problems Heart disease"", 'Pompe disease : It affects the enzyme alpha-glucosidase (GAA) . This enzyme breaks down the sugar glycogen into glucose. Without GAA, glycogen builds up in muscle cells and other cells. Symptoms include: Severe muscle weakness Poor muscle tone Lack of growth and weight gain in infants An enlarged heart , liver, or tongue Tay-Sachs disease: This is caused by a lack of the enzyme hexosaminidases A (Hex-A) . This enzyme breaks down a fatty substance called GM2 ganglioside in brain cells. Without it, the fat builds up in nerve cells and damages them. Babies with Tay-Sachs grow normally for the first few months of life. Then their development slows. They lose control over their muscles. It becomes harder for them to sit, crawl, and walk. Other symptoms include: A red spot in the back of the eye Vision and hearing loss Seizures', ""How Do These Disorders Happen? Most lysosomal storage disorders are passed down from parents to their children. Usually, a child has to inherit the faulty gene from both parents. If a child gets the gene from only one parent, they will be a carrier and won't show symptoms."", 'The faulty genes affect how your body makes enzymes that break down material in the cells. Lysosomal storage diseases are rare, but some forms are more common in certain groups of people. For example, Gaucher and Tay-Sachs happen more often in people of European Jewish descent.', 'Symptoms The symptoms depend on which enzyme is missing. Each of these conditions has different symptoms based on the cells and organs it affects.', ""Diagnosis Your doctor can test for these disorders in your baby during pregnancy . If you have a child with symptoms, blood tests can look for the enzyme that's missing. The doctor might also do these tests: MRI uses powerful magnets and radio waves to make pictures of the brain . Biopsy removes a small piece of tissue, which is checked under a microscope for signs of disease. Finding these diseases early is key. Treatments can slow lysosomal storage disorders and improve your child's outlook."", ""Treatments Though there isn't a cure for lysosomal storage disorders, a few treatments can help. Enzyme replacement therapy delivers the missing enzyme through a vein (IV). Substrate reduction therapy reduces the substance that is building up in the cells. For example, the drug miglustat (Zavesca) treats one form of Gaucher disease. Stem cell transplant uses donated cells to help the body make the enzyme it's missing. Treatments to manage symptoms of the disease include: Medicine Surgery Physical therapy Dialysis (a treatment that removes toxic substances from the body)""]"
1,What Is a Prolactinoma?,"[""The pituitary gland is a pea-sized gland at the base of your brain . It makes several different hormones, including one called prolactin. Prolactin affects the mammary glands and helps women make breast milk. Sometimes, a tumor grows on the pituitary gland and makes too much prolactin. This kind of tumor is called a prolactinoma. It's the most common type of pituitary tumor and is most often benign, which means it’s not cancer. A new mom's prolactin levels go up every time their\xa0baby nurses. But for men or women who aren't nursing, high prolactin in the blood can be a sign of a prolactinoma. Doctors don't know what causes it, but it's fairly common. It happens more often in women than men, and it's rare in kids."", 'Symptoms The signs of a prolactinoma are different in men and women. For women, typical symptoms of a small tumor include: Irregular menstrual periods Lack of menstrual periods Low sex drive Painful intercourse (caused by vaginal dryness ) Problems with fertility Unusual production of breast milk', ""Because changes in a woman's period are obvious, prolactinomas are more likely to be found early in premenopausal women. Postmenopausal women, who no longer get their periods, may not notice symptoms when the tumor is small. When a prolactinoma becomes large, it may press up against other nearby tissues. Symptoms then can include vision loss , vision changes , and headaches. When a man is diagnosed with a prolactinoma, it tends to be large. Men often aren't diagnosed when they have early signs, which include: Problems getting or maintaining an erection Decreased interest in sex Breast milk production in rare cases Headaches or vision problems are usually the symptoms that bring men to the doctor."", 'Diagnosis You can expect a physical exam , a medical history questionnaire, and a blood test. If the test shows a high prolactin level, your blood also may be tested to find out how well your thyroid is working. If your doctor thinks you might have a pituitary tumor, they may order an MRI (magnetic resonance imaging). This uses powerful magnets and radio waves to get a clear picture of your pituitary gland. If a prolactinoma is found, you may need more blood tests to see if your pituitary gland is making other hormones like it should. You may also need more MRIs to see if the tumor grows and if it responds to treatment.', ""Treatment Certain drugs can shrink it, especially when it's small. This works well for about 80% of people who have the tumor. The two approved medications for prolactinoma are bromocriptine ( Parlodel ) and cabergoline ( Dostinex ). They are dopamine agonists. These drugs act like the brain chemical dopamine, which normally keeps the pituitary gland from making too much prolactin. When medical treatment works, most premenopausal women get their periods again and regain their fertility. If medication doesn't shrink the tumor, or you can't take it because of side effects (like nausea or dizziness ), your doctor may recommend surgery to take the tumor out through your nasal cavity. This returns prolactin levels to normal for about 80% of people with small tumors. But it's successful for only 30% to 40% of people with larger tumors. In rare cases, radiation therapy is used if medicine and surgery don't bring down prolactin levels. This works for about 1 in 3 people.""]"
2,What Is Galactosemia?,"['Breast milk is full of good things that babies need -- key nutrients, hormones, and antibodies that protect them from disease and keep them healthy. But some babies are born with galactosemia . It’s a rare metabolic condition that prevents them from processing galactose (one of the sugars in breast milk and formula ) and turning it into energy. The disorder can cause many problems for newborns and can be life-threatening if left untreated. It’s easy to test for galactosemia. It’s also simple to treat once it’s diagnosed. And children who have it can live normal lives.', 'What Causes It? Galactosemia is hereditary. Both parents must pass it down for their child to get it. If your baby has this condition, it means the genes that produce the enzymes to break down galactose into glucose (a sugar ) are missing key parts. Without these parts, the genes can’t tell the enzymes to do their job. This causes galactose to build up in the blood , creating problems, especially for newborns.', 'There are three main types of galactosemia: Classic (type I) Galactokinase deficiency (type II) Galactose epimerase deficiency (type III) Type I occurs in about 1 in every 30,000 to 60,000 people. Type II and type III are less common. As a parent or potential parent, you and your partner can be genetically screened for galactosemia. If you’re a carrier , it doesn’t mean you have to avoid galactose. But it means you can pass galactosemia along to your children if your partner is also a carrier.', 'Symptoms If your newborn has classic galactosemia, they’ll appear normal at birth. Symptoms start to show up within a few days after they begin to drink breast milk or formula with lactose -- the milk sugar that contains galactose. Your baby first loses their\xa0appetite and starts vomiting . Then they get jaundice , a yellowing of the skin and the whites of their eyes . Diarrhea is common, too. The disease leads to severe weight loss and your baby struggles to grow and thrive. Without treatment, over time your child may develop cataracts and can be susceptible to infections. They may have liver damage and kidney problems. Their brain may not mature well. That can cause developmental disabilities . Some children have issues with their motor skills and muscles. For girls, it can cause their ovaries to stop working. Most with this condition can’t have children.', 'Testing and Treatment Every baby born at a U.S. hospital is given what’s called a newborn screening . A blood sample is taken from a heel stick (a tiny cut in the baby’s foot ) and it is tested for several conditions. Galactosemia is one of them. If your baby shows signs of the illness, your doctor will suggest a follow-up test to confirm. This test will include both a blood and urine sample. If your child has galactosemia, your doctor will work with you to plan a diet. Lactose and galactose are taken out of their\xa0diet. Instead, they’re given soy-based formula and must avoid milk or milk byproducts. Your doctor will likely refer your child to a specialist. Though a person with galactosemia will never be able to process this type of sugar, they can live normal lives if the disease is caught early enough. Along with eliminating dairy, your doctor may recommend cutting out some fruits, vegetables, and candies that contain galactose. In addition, your child may need to take vitamin and mineral supplements such as calcium , vitamin C , vitamin D , and vitamin K .', 'Some babies have a form of the condition called Duarte galactosemia (DG), which is milder than the classic form (type I). Babies with DG may have some issues processing galactose but a recent showed that changing the diet change may not be necessary and most babies do fine continuing breastfeeding or continuing formula with galactose.. Babies with type II or type III also will have fewer issues than babies with classic galactosemia. However, they still can develop cataracts , kidney and liver issues, and have delayed growth. Girls with galactosemia may require hormone treatment when they reach puberty . It’s important that parents of a child with galactosemia work with a health care team to find ways to help them live with the condition and its effects on their\xa0daily life.']"
3,Cholecystitis,"['What Is Cholecystitis? Cholecystitis is a swelling and irritation of your gallbladder , a small organ in the right side of your belly near your liver . The gallbladder’s job is to hold a digestive juice called bile. It releases bile into your small intestine when your body needs it to break down fats. But if the path to your small intestine is blocked, bile gets trapped. That backup can irritate your gallbladder. That’s how cholecystitis happens. Nausea and vomiting are common symptoms. They often show up after you’ve eaten a big or especially fatty meal. It’s easy to mistake cholecystitis for other health problems, but another telltale sign is intense pain -- in your belly, in your back, or under your right shoulder blade. If you don’t see a doctor and get treatment, it can lead to dangerous infections or become a long-term condition. The most common solution is surgery to remove your gallbladder.', 'Cholecystitis Symptoms Cholecystitis can mimic other health problems, so you’ll need to see a doctor for a diagnosis.', 'You might feel a sharp, sudden pain in the upper right side of your belly. You may also feel pain in your back or below your right shoulder blade. Deep breaths may make it worse. Some other symptoms to watch out for include: Nausea Vomiting Fever Bloating Yellow skin or eyes ( jaundice ) Bowel movements that are loose and light-colored Symptoms may get worse after a high- fat meal. If you can’t get comfortable or sit still because your pain is so strong, head to an emergency room.', 'Cholecystitis Causes The usual reason bile backs up is that gallstones -- lumps of bile turned solid -- block the way to the small intestine. Gallstones are common. About 10% to 20% of Americans have them. About half of people with gallstones will get cholecystitis. But gallstones aren’t the only problem that can cause this condition. Others include: Gallbladder sludge, a thick liquid, builds up in the organ. This can happen if you’re pregnant or if you’ve lost a lot of weight quickly. Tumors block bile’s path. A growth in your pancreas or liver can stop it from draining. Your gallbladder doesn’t have a good blood supply. People with diabetes can have this problem. An infection affects your gallbladder. Bacteria can damage the system that drains bile, causing it to back up. Cholecystitis can come on suddenly. You may hear a doctor or nurse call it an “acute” case. Or it can be a long-term problem. Those cases are called “chronic.”', ""Cholecystitis Risk Factors You have a higher chance of getting cholecystitis if you: Are a woman older than 50 Are a man older than 60 Are overweight Have diabetes Are pregnant Or if you have: Crohn's disease End-stage kidney disease H eart disease Hyperlipidemia (when your blood has too many lipids in it) Sickle cell disease Quick weight loss You also run a bigger chance of getting it if your diet is high in fat and cholesterol or your ancestry is Native American, Hispanic, or Scandinavian."", 'Cholecystitis Diagnosis The doctor will examine you, ask a few questions about your symptoms, and probably order some tests. You should be ready to: Detail when your symptoms started. Have you felt this way before? Describe how severe your pain is. Talk about whether anything makes your pain better or worse. Your doctor can tell from blood tests whether you have an infection and whether your liver is working the way it should. They may also want you to have some imaging tests . These may include: X-ray of your belly, which will show your internal organs, bones, and tissues Ultrasound , which will show your gallbladder and liver and let doctors check blood flow CT scan , which gives doctors a more detailed look at organs, muscles, and bones than an X-ray can HIDA scan, which checks how your gallbladder squeezes and\xa0if bile is blocked. You get a shot of a chemical, and then a scanner traces it as it moves through your body. PTC, which uses a dye injected into your liver to show how bile is moving through your body ERCP, which uses a long, flexible tube threaded down your throat, through your stomach , and into your small intestine. It has a light and camera at the end. This test also uses a dye to check how bile is flowing through your system.', 'Cholecystitis Treatment If you have cholecystitis, especially an acute case, you may have to spend some time in the hospital. You will have to keep your stomach empty so your gallbladder can rest. You’ll probably get fluids through a tube put into a vein. You may get pain medicine and, if doctors are concerned about infection, an antibiotic. Once treatment begins, you should start to feel better. If gallstones caused your problem, doctors may try medications to dissolve them and give you a prescription drug to keep them from forming again. A very low-fat diet may also keep them from coming back.', 'What if I Need Surgery? By far the most common treatment is to take out the gallbladder. Your doctor may decide to do the surgery right away, unless you’re too sick. If you need to wait, doctors can ease symptoms by putting a tube through your skin straight into the gallbladder and draining some bile. Surgery to remove your gallbladder, called a cholecystectomy, usually takes about an hour and is considered low-risk.', 'You’ll get general anesthesia , so you won’t be awake or feel any pain during the procedure. The doctor will make a small cut in your bellybutton to take a look inside with a special instrument. They’ll then take out the gallbladder through another small cut. You can live a healthy life without your gallbladder.', 'Cholecystitis Prevention You can take steps to lower your chances of getting gallstone and cholecystitis. They include: Lower your cholesterol. Exercise regularly. Eat a diet rich in fruits, vegetables, and healthy fats . Eggs , soybeans, and peanuts are great choices. Obesity is a major risk factor for getting gallstones. Losing weight can reduce your chances, but be sure you do it in a healthy way. If you’re planning a rapid weight loss program , such as weight loss surgery , your doctor or nurse should monitor you. They may recommend bile acid pills to prevent gallstones as you lose weight.', 'Cholecystitis Complications If you don’t get treatment, your gallbladder can become infected, and some of the tissue may die. Infection can also spread to other parts of your body, including your pancreas ( pancreatitis ) and the lining of your belly ( peritonitis ). If the tubes that carry bile are damaged too much, cholecystitis can harm your liver, too. You could have repeated bouts of painful symptoms. Eventually, your gallbladder will shrink and not work as well. The condition would become a long-term, or chronic, problem.']"
