,title,body
32,Hirsutism,"What Is Hirsutism? Hirsutism is a condition in women and people assigned female at birth (AFAB) in which you have a lot of hair growing in places where it usually does just for men. It can also affect men and people assigned male at birth (AMAB), but the condition is often harder  to identify. In men, hirsutism may look like typical hair growth. The hair is often dark and coarse instead of the light, fine “peach fuzz” that covers most of the body. About 5%-10% of women in the U.S. have hirsutism. Polycystic ovary syndrome, or PCOS, can cause hirsutism. (Photo Credit: Freemanhan2011/Dreamstime) Hypertrichosis Hypertrichosis also causes excess hair growth, but it’s a different condition than hirsutism. With hypertrichosis, excess hair grows anywhere on your body. On the other hand, people with hirsutism have a lot of hair growth on specific areas that depend on male hormones, such as the face, chest, back, and stomach. Symptoms of Hirsutism With hirsutism, extra hair will grow on your: Face Chest Lower stomach Inner thighs Back Virilization Virilization is a process in which women or people AFAB develop male traits. It can happen when people with hirsutism have high hormone levels. Signs of virilization include: A deep voice Balding Acne More muscle mass Smaller breasts An enlarged clitoris Causes of Hirsutism Hirsutism is caused by high levels of male hormones (called androgens). It's normal for women's bodies to make androgens, and low levels don't cause excess hair growth. But when these amounts are too high, they can cause hirsutism and other things, like acne, a deep voice, and small breasts. Sometimes, a person’s androgen levels may be normal, but their hair follicles are overly sensitive to male hormones. This is called follicle sensitivity, and it can also lead to hirsutism. Some possible reasons for high levels of androgens include: Polycystic ovary syndrome (PCOS), which causes small cysts, or fluid-filled sacs, to form on your ovaries . Cushing's syndrome , which you get when you have high levels of the stress hormone cortisol for long periods of time. Tumors in your adrenal glands (which make hormones like cortisol) or your ovaries. Medication . Some drugs can change the hormone levels in your system, so you grow unwanted hair on your face or body. This can happen with: Drugs that have hormones, like anabolic steroids Drugs that spur hair growth, like minoxidil ( Rogaine ) A drug called danazol ( Danocrine ) that can help with endometriosis , when the tissue that lines the uterus grows outside the womb High insulin levels. Insulin can trigger the ovaries to produce androgens. Congenital adrenal hyperplasia is an inherited condition that can cause your adrenal glands to make too much androgen. Menopause. Hormone changes can happen after menopause. Some women and people AFAB have idiopathic hirsutism, which means there’s no known cause. Does hirsutism mean you have PCOS? PCOS is the most common cause of hirsutism. But hirsutism, by itself, doesn’t mean you have PCOS. Extra hair growth is simply a symptom of PCOS that affects up to 70% of women and people AFAB with the condition. Other signs of PCOS are: Irregular menstrual cycles Weight gain Thinning hair Acne Darkening of skin or skin tags Risk Factors for Hirsutism Women and people AFAB are most likely to develop hirsutism. A few other things can make hirsutism more likely, including: Family history. Some conditions that run in families and affect your hormones can cause hirsutism. Ancestry. People of Mediterranean, Hispanic, South Asian, or Middle Eastern descent are more likely to have extra body hair. Obesity. Being overweight causes your body to make more male hormones, which can make hirsutism worse. Hirsutism Diagnosis Your doctor will look at your hair growth and check for any other signs of hirsutism, like acne . They might rule out other conditions with tests including: Blood tests to check your hormone levels Ultrasound to look at your ovaries and uterus X-ray or CT scan to examine your adrenal glands MRI of the brain Once a diagnosis is made, your doctor might use something called the Ferriman-Gallwey scale. This tool helps them determine how severe your condition is by looking at hair growth in nine areas of your body. To calculate the Ferriman-Gallwey score, health providers use a scale that ranges from 0 to 4 for each body location. A lower score means your hirsutism is mild, while a higher core indicates a more severe condition. Treatments for Hirsutism If you have more facial or body hair than you want, there are a number of ways you can remove it: Weight loss . If you’re overweight and drop pounds, your body may make fewer male hormones. Shaving. You can remove unwanted hair easily with a razor or electric shaver. You may need to shave daily to avoid stubble growth. Some people get razor burn from shaving too often, but a soothing cream may help. Tweezing or threading. There are different ways to pluck hair out at the root. You can use tweezers. Or you can hire someone to “thread” – use a long, tight strand to loop around and remove each unwanted hair. These methods can cause pain and redness. Waxing. A quick way to remove lots of unwanted hair by the root is with melted wax. Often, you get this done in a salon. Wax is applied to the skin and then removed quickly. It can cause pain and redness. Creams. Some creams have strong chemicals called depilatories. You apply the cream and let it sit for a while, and when you wipe it off, the hair goes with it. They can irritate sensitive skin, so test a small spot before you use one on a large area. Electrolysis. You can remove hair for good with electrolysis, a service that zaps hair at the root with an electric current. After you repeat the process several times, hair should stop growing in treated areas. Laser hair removal . The heat from lasers removes hair at the root, but you need to repeat the process several times, and it sometimes grows back. Medication. Doctors can prescribe drugs that change the way your body grows hair. But when you stop using it, hair will grow back. Birth control pills make the body produce fewer male hormones. With regular use, you should have less hair on your face or body. Anti-androgens help your body make and use fewer male hormones. Eflornithine ( Vaniqa ) is a face cream that slows hair growth where you apply it. Bleaching products can lighten the hair on your body. Low-dose steroids may be prescribed if your adrenal glands are overactive. Gonadotropin-releasing hormone (GnRH) agonists lower the amount of androgen that’s produced in the ovaries. They are injected and can be expensive. Insulin-lowering drugs , such as metformin (Glucophage) or pioglitazone (Actos), can also lower levels androgens in the blood. But because they can cause side effects, they usually aren’t used as a first-line treatment option. Complications of Hirsutism Hirsutism can cause emotional distress. People with the condition can have a poor self-image due to the unwanted hair. You may even have symptoms of depression or anxiety. Hirsutism Prevention You may be able to lessen your chances of getting hirsutism, depending on the cause. If you have PCOS, here are some ways to lower your risk: Eat a healthy, low-calorie diet Lose weight Exercise regularly Talk to your doctor if you take medicines that can cause hirsutism. You may be able to adjust some of these drugs. Takeaways Hirsutism causes excessive hair growth, mainly in women and people AFAB. Though the symptoms of this condition can feel embarrassing, there are treatments available if you want to lessen the amount of facial and body hair. Talk to your doctor if you think you might have hirsutism. Hirsutism FAQs What is the cause of hirsutism? Hirsutism is caused by too many male hormones (called androgens) in your body. Or, a hair follicle sensitivity to male hormones is another possible culprit. Various conditions can cause your body to make too many androgens. And sometimes, doctors don’t know why this happens. How do you get rid of hirsutism? There are treatments to help slow down your hair growth and lessen unwanted hair. But no therapies will make the hair completely go away. Can you ever get rid of hirsutism? If you have hirsutism, you will need continuing treatment if you want to address your symptoms. Most people find an effective therapy that they can use as a long-term fix."
33,What Is Langerhans Cell Histiocytosis?,"You may know that white blood cells are your body’s infection fighters. But if your body makes too much of a type of immune cell called histiocytes, they can cause tumors, lesions, and other tissue damage. One of these rare disorders -- which resembles some types of cancer -- is called Langerhans cell histiocytosis, or LCH. It most commonly appears in toddlers and very young children, but you can have it as an adult, too. Symptoms LCH can show up on many places on your body, but most often on your skin and bones. It can affect any organ, including your lungs , liver , brain , spleen , or lymph nodes . In about 8 out of 10 people, LCH leads to tumors called granulomas in the skull and in other bones. That can cause pain and swelling, and sometimes it can fracture your arms or legs. LCH symptoms can range from mild to more serious. Some people are born with it, and the disease eventually goes away on its own. But others have a severe and long-lasting type that affects multiple parts of the body. Along with your bones, it can affect your: Skin. Red, scaly bumps in skin folds are common. Infants with LCH can get red, scaly scalps, which is often mistaken for cradle cap , a common skin condition. Liver . Usually, only severe cases of LCH affect the liver. Your skin might appear jaundiced, or yellow, and your blood can take longer to clot. Lymph nodes. These glands, which are behind the ears , in the neck, and in other places, can swell up. You also might have trouble breathing or have coughs . Diagnosis Your doctor will know if you have LCH after a tissue biopsy . That’s when a specialist called a pathologist views the sample under a microscope for specific proteins and other markers of the disease. In addition to the physical exam , your doctors may order other tests based on your symptoms: X-rays of your lungs and bones Bone marrow biopsy to look for signs of LCH Blood chemistry test to check your kidneys , liver , thyroid , and immune system MRIs and PET and CT scans to get detailed images of your body Urinalysis to check levels of red and white cells, protein, and sugar in your pee Causes We don’t know all the reasons why some people get LCH. About half of the people with the disorder have a faulty gene that makes the Langerhans immune cells grow out of control. That genetic mutation happens after birth, which means you usually won’t get LCH from your parents. Researchers suspect that other things may also play a role: Smoking Parents who were exposed to environmental toxins, like benzene or wood dust Infections as a newborn Family history of thyroid disease Treatments As with some types of cancer , doctors sometimes treat LCH with chemotherapy . Many people with the disorder get care from cancer specialists like oncologists and hematologists. But unlike most cancers, limited forms of LCH sometimes spontaneously go away on their own. Beside chemotherapy, options for treatment include: Low-dose radiation to targeted part of the body Surgery to remove LCH lesions Steroids like prednisone or anti-inflammatory drugs Ultraviolet light therapy for skin conditions Stem cell transplant Bone marrow, liver, or lung transplants in very serious cases A great majority of people with LCH recover with treatment. If the disease is in your spleen, liver, or bone marrow, it’s called a high-risk LCH. About 80% of people with that type survive."
34,Hives and Your Skin,"Urticaria, also known as hives, is an outbreak of pale red bumps or welts on the skin that appear suddenly. The swelling that often comes with hives is called angioedema. Allergic reactions, chemicals in certain foods, insect stings, sunlight, and medications can cause hives. It's often impossible to find out exactly why hives have formed. What Causes Hives? There are several types of hives, including: Acute urticaria. These are hives that last less than 6 weeks. The most common causes are foods, medications, and infections. Insect bites and diseases may also be responsible. The most common foods that cause hives are nuts, chocolate, fish, tomatoes, eggs, fresh berries, and milk. Fresh foods cause hives more often than cooked foods. Certain food additives and preservatives may also be to blame. Drugs that can cause hives include aspirin and other nonsteroidal anti-inflammatory medications such as ibuprofen, high blood pressure drugs (especially ACE inhibitors), or painkillers such as codeine. Chronic urticaria. These are hives that last more than 6 weeks. The cause is usually harder to identify than those causing acute urticaria. For most people with chronic urticaria, the cause is impossible to find. In some cases, though, the cause may be thyroid , hepatitis, infection, or cancer. Chronic urticaria can also affect organs such as the lungs, muscles, and gastrointestinal tract. Symptoms include shortness of breath, muscle soreness, vomitin g , and diarrhea. Physical urticaria. These hives are caused by something that stimulates the skin -- for example, cold, heat, sun exposure, vibration, pressure, sweating, or exercise. The hives usually occur right where the skin was stimulated and rarely appear elsewhere. Most of the hives appear within 1 hour. Dermatographism. This is a common form of physical urticaria where hives form after firmly stroking or scratching the skin. These hives can also occur along with other forms of urticaria. The Link to Contact Dermatitis Contact dermatitis is a painful or itchy rash you get after your skin touches something you're allergic to (allergic contact dermatitis) or that's otherwise irritating to your skin (irritant contact dermatitis). It's not the same as hives. But sometimes people with contact dermatitis also get hives after they come into contact with an allergen. How Are Hives Diagnosed? Your doctor will need to ask many questions in an attempt to find the possible cause of hives. Since there are no specific tests for hives -- or the associated swelling of angioedema -- testing will depend on your medical history and a thorough exam by your doctor. Your doctor may do skin tests to find out what you're allergic to. Or they may test your blood to see if you have an illness. How Are Hives Treated? The best treatment for hives is to find and remove the trigger, but this is not an easy task. Antihistamines are usually prescribed by your doctor to provide relief from symptoms. Antihistamines work best if taken on a regular schedule to prevent hives from forming in the first place. Chronic hives may be treated with antihistamines or a combination of medications. When antihistamines don't provide relief, oral steroids may be prescribed. A biologic drug, omalizumab (Xolair), is also approved to treat chronic hives in people at least 12 years old. For severe hives, you might need an injection of epinephrine or a cortisone medication. How Can Hives Be Managed? While you're waiting for hives and swelling to disappear, here are some tips: Apply cool compresses or wet cloths to the affected areas. Try to work and sleep in a cool room. Wear loose-fitting lightweight clothes. When Should I Call the Doctor About Hives? If you have hives with any of the following symptoms, contact your doctor right away: Dizziness Wheezing Difficulty breathing Tightness in the chest Swelling of the tongue, lips, or face"
35,What Is Hypoplastic Left Heart Syndrome?,"Sometimes during pregnancy, the left side of a baby's heart doesn't grow the way it should. This causes a rare defect called hypoplastic left heart syndrome (HLHS). About 1,000 babies are born with it in the U.S. each year. Normally, the right side of your heart pumps blood from your heart to your lungs where it gets oxygen. After it goes back to your heart, the left side then pumps the oxygen-rich blood to the rest of your body. The heart of a baby with HLHS can't do this. The lower left chamber may be smaller than normal or not there at all. The valves on the left side may not work right or the main artery leaving the heart may not be as big as it should be. A baby with HLHS also may have a hole between the left and right upper chamber of their heart. This is called an atrial septal defect, and it can cause too much blood to flow to the lungs . Signs of HLHS may not show up until a few days after birth. For the first day or two, a baby's heart can adjust to the defect. If the left side of the heart can't pump blood very well to the rest of the body, the right side will do more work. But the adjustment only lasts a few days. A newborn has a blood vessel that connects the two sides of their heart. It's called the patent ductus arteriosus, and it stays open for only a few days after birth. After that, it naturally closes. This is when most babies with the defect start to show symptoms from the lack of oxygen-rich blood and overworked heart. Cause Doctors don't know why HLHS happens, but it does run in families. Some experts think that what the mother eats, drinks, or comes into contact with during pregnancy may also increase the risk that their baby will have HLHS. This might include smoking or drinking alcohol or not taking a prenatal vitamin with folic acid . Symptoms and Diagnosis Heart defects can show up on an ultrasound during the second trimester of pregnancy. So some parents find out about it before their babies are born. In other cases, HLHS is found a few days after the baby's born. The signs include: Being sleepy or not wanting to move Cold hands and feet Fast breathing or difficulty breathing Gray or blue skin Not eating well When your doctor listens to your baby's heartbeat, they may hear a heart murmur, which sounds like a whooshing noise. This happens because of the unusual blood flow HLHS causes. If your doctor thinks your baby might have HLHS, they'll order an echocardiogram. This test uses sound waves to make images of their heart on a video screen. It can show the chambers of the heart and track blood flow. Treatment It's important that HLHS is diagnosed and treated right away. If not, your baby's organs won't get enough blood. That can make them go into shock. Treatments include: Medicine: Your baby may be given a drug called alprostadil (Prostin VR Pediatric) to help keep the ductus arteriosus open. They may also need medicine to make their heart muscle stronger, lower blood pressure , and help their body get rid of extra fluids. Help with feeding and breathing: Your baby will be weak and will likely need to get fluids through an IV or a feeding tube. A breathing machine called a ventilator may also be used to make sure your baby gets enough oxygen. Atrial septostomy. If your baby doesn't have an atrial septal defect, your doctor may recommend this surgery. It creates an opening between the heart's upper chambers to let more blood flow through. A baby with HLHS also may go through a series of surgeries to help repair their heart. The first, called the Norwood procedure, is done soon after birth. It's a complicated surgery that makes a new aorta for your baby and lets the right ventricle of the heart pump all the blood to the body (after the ductus closes). Two other surgeries to rebuild the heart and let blood flow the right way usually follow. The timing depends on your child's condition, but the next surgery, known as the Glenn, is usually done when your baby is a few months old. The third surgery is called the Fontan procedure and happens when they are 3 or 4 years old. In some cases, your doctor may suggest a heart transplant. This will give your child a healthy heart, but it can take time to find a donor. They'll also need to take medicine for the rest of their life so their body doesn't reject it. Outlook Your child will need lifelong care from a heart doctor (cardiologist) who specializes in birth defects. Your child also probably will need more surgery, and there's a good chance that they may have other heart problems, such as irregular heart rhythms and blood clots . An infant who has surgery to rebuild their heart may grow up physically weaker than other kids and could have some development issues. They may need extra support at home and school."
36,Understanding Hodgkin Lymphoma -- the Basics,"What Is Hodgkin Lymphoma? Hodgkin lymphoma, also known as Hodgkin's disease , is a type of lymphoma , a cancer of the lymphatic system. The lymphatic system is a network of nodes (knots of tissue) connected by vessels that drain fluid and waste products from the body. The lymph nodes act as tiny filters, straining out foreign organisms and cells. The lymphatic system also is involved in producing important white blood cells called lymphocytes that help protect you against various infections caused by bacteria, viruses, and fungi. When the lymphatic system is fighting an active infection, you may notice that some of your lymph nodes and tissue in the area of the infection become swollen and tender. This is the body's normal reaction to infection. Lymphoma occurs when the lymph node cells or the lymphocytes begin to multiply uncontrollably, producing malignant cells that have the abnormal ability to invade other tissues throughout your body. The two main types of lymphoma are Hodgkin lymphoma and non-Hodgkin lymphoma, which are classified by certain unique characteristics of the cancer cells. Hodgkin disease is most common in two different age groups: young adults (ages 15 to 35) and older adults (over age 50). It is somewhat more common in males than females, and more common in Caucasians than in African-Americans. Because of progress in treating Hodgkin lymphoma, most people with a diagnosis of Hodgkin lymphoma will be long-time survivors. What Causes Hodgkin Lymphoma? The exact cause of Hodgkin lymphoma is not known, but the following have been implicated: Viruses: The Epstein-Barr virus, the same virus that causes infectious mononucleosis (mono), has been implicated as a cause of Hodgkin lymphoma. The presence of the genome of this virus is seen in 20%-80% of Hodgkin lymphoma tumors. Familial : Same-sex siblings and an identical twin of a person with Hodgkin lymphoma are at high risk of developing the disease. Children with a parent who has Hodgkin are also at an increased risk. Environment: Fewer siblings, early birth order, single-family homes, and fewer playmates are associated with an increased risk of developing Hodgkin lymphoma -- possibly due to a lack of exposure to bacterial and viral infections at an early age."
