,title,body
27,What Is Glioblastoma?,"['Glioblastoma is a type of brain cancer . It’s the most common type of malignant brain tumor among adults. And it is usually very aggressive, which means it can grow fast and spread quickly. Although there is no cure, there are treatments to help ease symptoms.', ""Where It Forms in the Brain Glioblastoma is a type of astrocytoma , a cancer that forms from star-shaped cells in the brain called astrocytes. In adults, this cancer usually starts in the cerebrum, the largest part of your brain . Glioblastoma tumors make their own blood supply, which helps them grow. It's easy for them to invade normal brain tissue."", 'How Common Is It? Brain cancers aren’t common. And when they do happen, about 4 out of 5 aren’t glioblastomas. Men are more likely to get them than women. And chances go up with age. Doctors diagnose about 14,000 glioblastoma cases in the U.S. each year.', 'Symptoms Because glioblastomas grow quickly, pressure on the brain usually causes the first symptoms. Depending on where the tumor is, it can cause: Constant headaches Seizures Vomiting Trouble thinking Changes in mood or personality Double or blurred vision Trouble speaking', 'Causes and Risk Factors Experts aren’t exactly sure what causes glioblastoma. But certain things may make you more likely to have one, such as: Prior radiation to the head. If you previously got radiation to treat brain tumors or cancers that may have spread to the area, it can increase your risk for glioblastoma. Rare genetic conditions. If you have hereditary disorders linked to genetic mutations such as: Turcot syndrome Neurofibromatosis type 1 Li-Fraumeni syndrome Exposure to chemicals and other cancer-causing agents may also increase your risk for genetic mutations. Age and gender. It’s more common among those who are 50 or above. The average age for diagnosis is 64. Men are more likely to have it. Race. It’s more common among white people than among Black, Asian, and Indigenous groups.', 'Types There are two types: Primary glioblastoma. It makes up around 90% of the cases. This type of tumor tends to be aggressive and grows fast. It’s more likely to affect older people. You’re also likely to have a shorter life expectancy. Secondary glioblastoma. This type usually develops from a low-grade glioma – a type of tumor found in the brain or spinal cord. It’s more likely to affect younger people, and it’s usually in the frontal lobe of the brain. The survival rate for this type tends to be better than for primary glioblastoma.', 'Diagnosis A neurologist (a doctor who specializes in diagnosing and treating brain disorders) will give you a complete exam. You may get an MRI or CT scan and other tests, depending on your symptoms.', 'Stages Doctors don’t group glioblastoma by stages. Instead, they give all brain cancers a “grade.” It ranges from 1 to 4. The grade is based on how the cancer cells look under a microscope and how likely they are to reproduce. Glioblastomas are always recognized as grade 4 brain cancer. That’s because this type is very aggressive and the cancer cells multiply quickly.', 'Treatment The goal of glioblastoma treatment is to slow and control tumor growth and help you live as comfortably and as well as possible. There are four treatments, and many people get more than one type: Surgery is the first treatment. The surgeon tries to remove as much of the tumor as possible. In high-risk areas of the brain, it may not be possible to remove all of it.', ""Radiation is used to kill as many leftover tumor cells as possible after surgery. It can also slow the growth of tumors that can't be removed by surgery. Chemotherapy may also help. Temozolomide is the most common chemotherapy drug doctors use for glioblastoma. Carmustine (BCNU) and lomustine (CCNU) are other chemotherapy drugs that might be used. Targeted therapy with the drug bevacizumab ( Avastin , Mvasi) may be given if chemotherapy has not been effective. Convection-enhanced delivery (CED) uses a pump to release a slow, continuous stream of chemotherapy or targeted therapies to a tumor. Electric field therapy uses electrical fields to target cells in the tumor while not hurting normal cells. To do this, doctors put electrodes directly on the scalp. The device is called Optune. You get it with chemotherapy after surgery and radiation. The FDA has approved it for both newly diagnosed people and people whose glioblastoma has come back. Wafer therapy (Gliadel) uses an implanted, biodegradable disc that releases chemotherapy to any cancerous tissue that is left after surgery. Nanoparticle therapy uses tiny particles to carry chemotherapy directly into the tumor."", 'At major cancer centers, you may also be able to get experimental treatments or oral chemotherapy, which you take at home. These treatments may help with symptoms and possibly put the cancer into remission in some people. In remission, symptoms may let up or disappear for a time. Glioblastomas often regrow. If that happens, doctors may be able to treat it with surgery and a different form of radiation and chemotherapy. Palliative care is also important for anyone with a serious illness. It includes taking care of your pain and the emotions you may be dealing with, as well as other symptoms from your cancer. The goal is to improve the quality of your life. You may also want to ask your doctor if there’s a clinical trial that would be a good fit for you.', 'Outlook and Survival Rates Many things can affect how well someone does when they have cancer, including glioblastomas. Doctors often can’t predict what someone’s life expectancy will be if they have a glioblastoma. But they do have statistics that track how large groups of people who’ve had these conditions tend to do over time.', 'For glioblastoma, the survival rates are: One year: 25% Two years: 8-12% Five years: 5% These numbers can’t predict what will happen to an individual, though. A person’s age, type of tumor, and overall health play a role. As treatments improve, people newly diagnosed with these aggressive brain tumors may have a better outcome.', 'Glioma vs. Glioblastoma Glioma is one the most common types of primary brain cancer. It’s an umbrella term for tumors that develop from glue-like cells known as glial cells that surround nerve cells in your brain or spinal cord. Glioblastoma is a type of glioma. All advanced forms of glioma, also known as grade 4 glioma, are called glioblastoma, the most aggressive type of glioma.']"
28,Interstitial Lung Disease (ILD),"[""What Is Interstitial Lung Disease? Interstitial lung disease (ILD) is a group of many lung conditions. All interstitial lung diseases affect the interstitium, a part of your lungs . The interstitium is a lace-like network of tissue that goes throughout both lungs . It supports your lungs' tiny air sacs, called alveoli. Normally, the interstitium is so thin that it doesn’t show up on X-rays or CT scans."", 'Types of Interstitial Lung Disease All forms of interstitial lung disease cause the interstitium to thicken. This can happen from inflammation , scarring, or a buildup of fluid. Some forms of ILD last a short time (acute); others are long-term (chronic) and don’t go away. Some types of interstitial lung disease include: Interstitial pneumonia . Bacteria, viruses, or fungi can infect the interstitium. A bacteria called Mycoplasma\xa0pneumoniae is the most common cause. Idiopathic pulmonary fibrosis . This makes scar tissue grow in the interstitium. \xa0Experts don’t know what causes it. Nonspecific interstitial pneumonitis. This is an interstitial lung disease that often affects people with autoimmune conditions such as rheumatoid arthritis or scleroderma . Hypersensitivity pneumonitis . This happens when dust, mold , or other things that you breathe irritate your lungs over a long time. Cryptogenic organizing pneumonia (COP). COP is a pneumonia-like interstitial lung disease without an infection. You might hear your doctor call this bronchiolitis obliterans with organizing pneumonia (BOOP). Acute interstitial pneumonitis. This is a sudden, severe interstitial lung disease. People who have it often need to be connected to a machine called a ventilator that breathes for them. Desquamative interstitial pneumonitis. This is an interstitial lung disease that partly results from smoking . Sarcoidosis . This causes interstitial lung disease along with swollen lymph nodes . It can also affect your heart , skin , nerves, and eyes . Asbestosis. This is an interstitial lung disease caused by\xa0breathing asbestos, a fiber used in building materials.', 'Interstitial Lung Disease Symptoms The most common symptom of all forms of interstitial lung disease is shortness of breath. Almost everyone with ILD will have breathlessness, which can get worse over time. Other symptoms of interstitial lung disease include: Cough , which is usually dry and doesn’t bring up mucus. Weight loss , most often in people with COP or BOOP. With most forms of ILD, shortness of breath develops slowly (over months). If you have interstitial pneumonia or acute interstitial pneumonitis, your symptoms will come on quickly (in hours or days).', 'Interstitial Lung Disease Causes and Risks The cause of most interstitial lung disease is unknown. Bacteria, viruses, and fungi can cause interstitial pneumonia. You can also get ILD if you regularly breathe in things that can bother your lungs. These include: Asbestos Bird proteins (such as from exotic birds, chickens, or pigeons) Coal dust or various other metal dusts from working in mining Grain dust from farming Silica dust Talc It’s rare, but certain drugs can cause ILD: Some antibiotics, like nitrofurantoin Some anti-inflammatory drugs, like rituximab Chemotherapy drugs like bleomycin Heart medications such as amiodarone Anyone can get interstitial lung disease, but some things can put you at higher risk: Age. Adults are much more likely to get ILD, but children can, too. Autoimmune disease like lupus , rheumatoid arthritis , and scleroderma Gastroesophageal reflux disease (GERD) Genetics. Some conditions are passed down among family members. Smoking Radiation treatments for cancer', 'Interstitial Lung Disease Diagnosis People with interstitial lung disease usually go to the doctor because of shortness of breath or\xa0a cough . Your doctor will probably use imaging tests of your lungs to find out the problem. Chest X-ray. A simple chest X-ray is the first test for most people with a breathing problem. Chest X-rays in people with interstitial lung disease may show fine lines in the lungs. CT scan . A CT scan takes multiple X-rays of the chest, and a computer creates detailed images of the lungs and surrounding structures. These tests can usually find interstitial lung disease. High-resolution CT scan. If your doctor thinks you have an interstitial lung disease, certain CT scan settings can get better-quality images of your interstitium. This can help your doctor diagnose you. Lung function test. You sit in a sealed plastic booth and breathe through a tube to measure your total lung capacity, which might be reduced if you have ILD. You may also be less able to transfer oxygen from your lungs into your blood. Lung biopsy . Looking at lung tissue under a microscope is often the only way for a doctor to know which type of interstitial lung disease you have. Lung tissue is collected in a procedure called a lung biopsy, which can be done several ways: Bronchoscopy . Your doctor will run a tube called an endoscope through your mouth or nose and into your airways. Tiny tools on the endoscope can take a sample of lung tissue. Video-assisted thoracoscopic surgery (VATS). Your doctor will make small cuts to insert tools that take samples from multiple areas of lung tissue. Open lung biopsy ( thoracotomy ). In some cases, you might need traditional surgery with a large incision in the chest to get a lung biopsy.', 'Treatments for Interstitial Lung Disease The treatment you get depends on the type of ILD you have and its cause. Antibiotics . These treat most interstitial pneumonias.\xa0Pneumonias caused by a virus usually get better on their own. Pneumonias caused by a fungus are rare but are treated with antifungal drugs. Corticosteroids. In some forms of interstitial lung disease, inflammation in your lungs causes damage and scarring. Corticosteroids\xa0cause your immune system’s activity to slow. This lessens the amount of inflammation in your lungs and the rest of your body. Inhaled oxygen. If you have low oxygen levels because of interstitial lung disease, inhaled oxygen may help your symptoms. Regular use of oxygen might also protect your heart from damage caused by low oxygen levels. Lung transplant . In advanced interstitial lung disease that has severely impaired you, you may need a lung transplant. Most people who have a lung transplant for interstitial lung disease make large gains in their quality of life and their ability to exercise.', 'Azathioprine (Imuran). This drug also slows down the immune system. It’s not shown to improve interstitial lung disease, but some studies suggest it might help. N- acetylcysteine (Mucomyst). This potent antioxidant may slow the decline of lung function in some forms of interstitial lung disease. You’ll take it in combination with other treatments. Other drugs are considered controversial for interstitial lung disease treatment, including: Cyclophosphamide (Cytoxan) Cyclosporine Methotrexate Nintedanib (Ofev) Pirfenidone (Esbriet) These medicines affect the way your immune system works. If your doctor thinks you need one, they’ll keep a close watch on you while you’re taking it. These medications can have serious side effects.', 'Interstitial Lung Disease Complications The complications of severe interstitial lung disease can be life threatening: High blood pressure in your lungs, known as pulmonary hypertension Respiratory failure Right-sided heart failure, known as cor pulmonale']"
29,What Is Retinoschisis?,"['Retinoschisis refers to the separation of the layers of the retina. The retina is the tissue inside the back of the eye that changes what you see into electrical signals that travel to the brain. When the retina splits, tiny lumps called cysts form between the layers. These cysts damage nerves and keep light signals from reaching the brain. Damaged nerves can make your vision blurry. There are two forms of this condition: Juvenile X-linked retinoschisis Degenerative (senile) retinoschisis', ""Juvenile X-Linked Retinoschisis This rare condition, sometimes called XJR, mainly affects boys and men. It damages an area in the middle of the retina called the macula. The macula gives you clear central vision, and lets you focus on things in front of you, like a book or computer. Sometimes the condition also can affect your side, or peripheral, vision. Causes XJR is caused by a change -- or mutation -- to a gene. If a girl gets the problem gene from a parent, they’ll carry the disorder but won't have symptoms. If a boy gets the gene, they’ll have the disorder."", ""If a mother has the gene, their female children have a 50% chance of being a carrier. Their male children have a 50% chance of having the disorder. Men who have the gene can't pass it to their sons, but their daughters will be carriers. Symptoms XJR starts at birth and usually affects both eyes. Symptoms can appear in the first few months of life. Some boys, though, aren't diagnosed until they start school and have trouble reading. Their vision often gets worse during childhood and then levels off for a while. When a man reaches their 50s and 60s, their vision might start to worsen again. Some people lose a lot of their vision by adulthood, but it's rare for retinoschisis to cause blindness. Other symptoms include: Eyes that look in different directions ( strabismus ) Poor close-up vision ( farsightedness ) Bleeding in your eye caused by damaged blood vessels In rare cases, the retina will pull away from the eye completely. This is called retinal detachment , and it can lead to serious vision loss. People who have retinal detachment will need surgery to fix it."", 'Diagnosis Your eye doctor will look for splits or tears in your retina. Tests for juvenile X-linked retinoschisis include: Optical coherence tomography (OCT) : Light waves make pictures of the retina. Ultrasound : Sound waves create pictures of the eyes. This can show bleeding in the eye. Electroretinogram (ERG): This measures electrical activity in the retina. A special sensor is placed in each eye. While you look at a flashing light, the doctor will see how your retinas respond. Gene tests: These look for the\xa0RS1 gene that causes juvenile X-linked retinoschisis. People with juvenile retinoschisis should get regular eye exams to check for vision loss. Treatment No medicine or surgery can treat a divided retina. Glasses can’t do much if your vision is bad because of nerve damage, but they can help if you’re nearsighted (can’t see far away) or farsighted. Large-print textbooks, computer screens, and other low-vision tools can help children in school. Bleeding in your eye is treated with a laser or with cold (cryotherapy) to close damaged blood vessels in the retina. Surgery can fix a detached retina. Researchers are testing new treatments for retinoschisis. One of these replaces the damaged gene with a copy of a healthy gene. Stem cell treatments are also being studied.', ""Degenerative Retinoschisis (Senile Retinoschisis) This form, sometimes called SR, usually affects men and women in their 50s to 70s, but it can start earlier in life. It’s not as serious as the juvenile form and rarely causes vision loss. Causes SR isn't caused by a problem gene, and it's not passed down through families. Doctors don't know exactly why the retina becomes damaged as some people get older. Symptoms SR doesn't usually cause vision loss or other symptoms and, typically, is only found during an eye exam. Over time, some people lose a little of their side vision. In rare cases, the retina can become detached. Diagnosis Tests your eye doctor might recommend include: Visual acuity test to check how well you can focus Field of vision test to measure your central and side vision Ophthalmoscopy with dilation to look at the back of your eye, including the retina Slit lamp exam to get a large, three-dimensional (3-D) view of the different parts of your eye"", ""Treatment People with degenerative retinoschisis usually don't need treatment. See your eye doctor for regular checkups to make sure you don’t have any vision loss. If the retina detaches, your doctor will treat it with surgery.""]"
30,Hives and Your Skin,"[""Urticaria, also known as\xa0hives, is an outbreak of pale red bumps or welts on the\xa0skin\xa0that appear suddenly. The swelling that often comes with hives is called angioedema. Allergic reactions, chemicals in certain foods,\xa0insect stings, sunlight, and\xa0medications\xa0can cause hives. It's often impossible to find out exactly why hives have formed."", 'What Causes Hives? There are several types of hives, including: Acute urticaria. These are hives that last less than 6 weeks. The most common causes are foods, medications, and infections. Insect bites and diseases may also be responsible. The most common foods that cause hives are nuts,\xa0chocolate, fish, tomatoes, eggs, fresh berries, and milk. Fresh foods cause hives more often than cooked foods. Certain\xa0food additives\xa0and preservatives may also be to blame. Drugs that can cause hives include\xa0aspirin\xa0and other nonsteroidal anti-inflammatory medications such as\xa0ibuprofen, high\xa0blood pressure drugs\xa0(especially ACE inhibitors), or painkillers such as codeine. Chronic urticaria. These are hives that last more than 6 weeks. The cause is usually harder to identify than those causing acute urticaria. For most people with chronic urticaria, the cause is impossible to find. In some cases, though, the cause may be thyroid ,\xa0hepatitis, infection, or\xa0cancer.', 'Chronic urticaria can also affect organs such as the\xa0lungs, muscles, and gastrointestinal tract. Symptoms include shortness of breath, muscle soreness, vomitin g , and\xa0diarrhea. Physical urticaria. These hives are caused by something that stimulates the skin -- for example, cold, heat, sun exposure, vibration, pressure,\xa0sweating, or\xa0exercise. The hives usually occur right where the skin was stimulated and rarely appear elsewhere. Most of the hives appear within 1 hour. Dermatographism. This is a common form of physical urticaria where hives form after firmly stroking or scratching the skin. These hives can also occur along with other forms of urticaria.', ""The Link to Contact Dermatitis Contact dermatitis is a painful or itchy rash you get after your skin touches something you're allergic to (allergic contact dermatitis) or that's otherwise irritating to your skin (irritant contact dermatitis). It's not the same as hives. But sometimes people with contact dermatitis also get hives after they come into contact with an allergen."", ""How Are Hives Diagnosed? Your doctor will need to ask many questions in an attempt to find the possible cause of hives. Since there are no specific tests for hives -- or the associated swelling of angioedema -- testing will depend on your medical history and a thorough exam by your doctor. Your doctor may do skin tests\xa0to find out what you're allergic to. Or they may test your blood to see if you have an illness."", ""How Are Hives Treated? The best treatment for hives is to find and remove the trigger, but this is not an easy task. Antihistamines are usually prescribed by your doctor to provide relief from symptoms.\xa0Antihistamines\xa0work best if taken on a regular schedule to prevent hives from forming in the first place. Chronic hives may be treated with antihistamines or a combination of medications. When antihistamines don't provide relief, oral steroids may be prescribed. A biologic drug,\xa0omalizumab\xa0(Xolair), is also approved to treat chronic hives in people at least 12 years old. For severe hives,\xa0you might need an injection of\xa0epinephrine or a\xa0cortisone\xa0medication."", ""How Can Hives Be Managed? While you're waiting for hives and swelling to disappear, here are some tips: Apply cool compresses or wet cloths to the affected areas. Try to work and\xa0sleep\xa0in a cool room. Wear loose-fitting lightweight clothes."", 'When Should I Call the Doctor About Hives? If you have hives with any of the following symptoms, contact your doctor right away: Dizziness Wheezing Difficulty breathing Tightness in the chest Swelling of the tongue, lips, or face']"
